sample id,data entry author,state,lab id,lab name,collection date,collection time (America/Los_Angeles),stored collectionTime,tested by,site id,site name,latitude,longitude,water temperature (f),air temperature (f),current weather,recent precipitation,tide,wave height,wind speed (mph),wind direction,Enterococcus modifier,Enterococcus (mpn/100mL),Ecoli modifier,Ecoli (mpn/100mL),Total Coliform modifier,Total Coliform (mpn/100mL),comments,pH,Salinity (PSU),Turbidity (NTU),Ammonia/NH3 (ppm),Nitrates/NO3 (mg/L),Nitrites/NO2 (mg/L),Nitrogen(NO3+NO2) (mg/L),Phosphate (mg/L),Dissolved Oxygen (mg/L),publication time
eddf75b5-bd86-4811-8039-8eb1444cc002,Google_114632842198855839133,California,16,South Bay,5/11/2025,10:00:00 AM,2025-05-11T17:00:00.000Z,CC,94,Ballona Marsh- Jefferson Inlet,33.971001,-118.431,,72,Sunny,FALSE,,,6,SW,=,95,,,,,,,,,,,,,,,2025-05-13T00:37:25.407Z
0c8d8bf7-fa61-4afb-8cbf-0066fe8a9b75,Google_114632842198855839133,California,16,South Bay,4/27/2025,10:30:00 AM,2025-04-27T17:30:00.000Z,CC,94,Ballona Marsh- Jefferson Inlet,33.971001,-118.431,,63,Partly_Cloudy,FALSE,,,,,=,11199,,,,,,,,,,,,,,,2025-04-29T00:47:19.334Z
69087c3b-9ed8-4102-bb02-a1201ea4bb5d,Google_114632842198855839133,California,16,South Bay,4/13/2025,10:00:00 AM,2025-04-13T17:00:00.000Z,CC,94,Ballona Marsh- Jefferson Inlet,33.971001,-118.431,,59,Overcast,FALSE,,,,,=,393,,,,,WATER LOOKED CLEANER THAT USUAL,,,,,,,,,,2025-04-14T23:26:26.236Z
86fa684f-2209-48ce-a352-c8287e1b5ca2,Google_114632842198855839133,California,16,South Bay,3/30/2025,10:00:00 AM,2025-03-30T17:00:00.000Z,CC,94,Ballona Marsh- Jefferson Inlet,33.971001,-118.431,,58,Light_Rain,FALSE,,,,,=,341,,,,,,,,,,,,,,,2025-04-01T00:40:58.989Z
6530ba67-9e8f-4676-93d8-ef5a7ad6b658,Google_114632842198855839133,California,16,South Bay,3/16/2025,10:30:00 AM,2025-03-16T17:30:00.000Z,CC,94,Ballona Marsh- Jefferson Inlet,33.971001,-118.431,,65,Partly_Cloudy,TRUE,,,,,=,548,,,,,,,,,,,,,,,2025-03-17T21:36:49.516Z
a94343ff-3dd5-498e-874f-44f04a6e79a5,Google_114632842198855839133,California,16,South Bay,1/19/2025,11:00:00 AM,2025-01-19T18:00:00.000Z,CC,94,Ballona Marsh- Jefferson Inlet,33.971001,-118.431,,55,Partly_Cloudy,FALSE,,,,,=,6131,,,,,a dead fish visible in water with trash; visible microbes in water sample (Daphnia),,,,,,,,,,2025-01-21T00:26:51.522Z
d135c5a3-8ef7-4022-894c-588ece9a00f8,Google_114632842198855839133,California,16,South Bay,1/5/2025,11:00:00 AM,2025-01-05T18:00:00.000Z,CC,94,Ballona Marsh- Jefferson Inlet,33.971001,-118.431,,68,Sunny,FALSE,,,,,=,2382,,,,,,,,,,,,,,,2025-01-06T23:30:33.583Z
79dd8777-5669-4455-83e3-6d17e7535eee,Google_114632842198855839133,California,16,South Bay,12/15/2024,11:00:00 AM,2024-12-15T18:00:00.000Z,CC,94,Ballona Marsh- Jefferson Inlet,33.971001,-118.431,,66,Sunny,FALSE,,,,,=,569,,,,,,,,,,,,,,,2024-12-17T00:50:20.025Z
0a94067b-4ab1-4759-b717-daa81d58a88c,Google_114632842198855839133,California,16,South Bay,12/1/2024,12:00:00 PM,2024-12-01T19:00:00.000Z,CC,94,Ballona Marsh- Jefferson Inlet,33.971001,-118.431,,65,Sunny,FALSE,,,,,=,369,,,,,,,,,,,,,,,2024-12-02T22:39:20.026Z
88cfcd6d-3716-4abf-a4e8-f9016b59dbc5,Google_114632842198855839133,California,16,South Bay,11/17/2024,11:00:00 AM,2024-11-17T18:00:00.000Z,CC,94,Ballona Marsh- Jefferson Inlet,33.971001,-118.431,,65,Sunny,FALSE,,,,,=,588,,,,,,,,,,,,,,,2024-11-18T23:39:56.775Z
174a6300-4719-4e87-90e0-e8c4f5511c92,Google_114632842198855839133,California,16,South Bay,11/3/2024,11:00:00 AM,2024-11-03T18:00:00.000Z,CC,94,Ballona Marsh- Jefferson Inlet,33.971001,-118.431,,71,Sunny,FALSE,,,6,NW,=,1182,,,,,ADDITIONAL CONTROLS: Staph MPN <10; E. coli MPN <10; Enterococcus fecalis MPN 1918,,,,,,,,,,2024-11-04T23:53:01.442Z
2a2aad9b-1953-489b-8fa6-9650721bd09b,Google_114632842198855839133,California,16,South Bay,10/20/2024,10:00:00 AM,2024-10-20T17:00:00.000Z,CC,94,Ballona Marsh- Jefferson Inlet,33.971001,-118.431,,74,Sunny,FALSE,,,,,=,228,,,,,,,,,,,,,,,2024-10-21T22:14:51.429Z
dc1fc32a-a055-4f5e-94a0-5621b274242a,Google_114632842198855839133,California,16,South Bay,10/6/2024,10:00:00 AM,2024-10-06T17:00:00.000Z,CC,94,Ballona Marsh- Jefferson Inlet,33.971001,-118.431,,63,Fog,FALSE,,,,,=,1616,,,,,,,,,,,,,,,2024-10-08T00:33:59.530Z
1da0d030-065f-45de-8b12-0758054a13c5,Google_114632842198855839133,California,16,South Bay,9/22/2024,10:00:00 AM,2024-09-22T17:00:00.000Z,CC,94,Ballona Marsh- Jefferson Inlet,33.971001,-118.431,,71,Partly_Cloudy,FALSE,,,,,=,10462,,,,,,,,,,,,,,,2024-09-24T00:11:09.882Z
efea7ae2-f199-454f-a34a-368c397e20be,Google_114632842198855839133,California,16,South Bay,5/5/2024,10:00:00 AM,2024-05-05T17:00:00.000Z,CC,94,Ballona Marsh- Jefferson Inlet,33.971001,-118.431,,61,Partly_Cloudy,FALSE,,,7,W,=,717,,,,,,,,,,,,,,,2024-05-07T00:55:46.009Z
859c6cc4-29bb-4206-8d3e-c455b4443de5,Google_114632842198855839133,California,16,South Bay,4/21/2024,10:00:00 AM,2024-04-21T17:00:00.000Z,CC,94,Ballona Marsh- Jefferson Inlet,33.971001,-118.431,,62,Overcast,FALSE,,,5,SW,=,31,,,,,,,,,,,,,,,2024-04-22T22:57:16.311Z
962cd19e-c618-44b8-aa7e-6e4fd9f80efb,Google_114632842198855839133,California,16,South Bay,4/7/2024,10:00:00 AM,2024-04-07T17:00:00.000Z,CC,94,Ballona Marsh- Jefferson Inlet,33.971001,-118.431,,58,Sunny,TRUE,,,5,SW,=,183,,,,,,,,,,,,,,,2024-04-08T22:36:58.181Z
8fbace57-a7db-436f-a5ca-5d8f8bce3db2,Google_114632842198855839133,California,16,South Bay,3/17/2024,10:00:00 AM,2024-03-17T17:00:00.000Z,CC,94,Ballona Marsh- Jefferson Inlet,33.971001,-118.431,,60,Partly_Cloudy,FALSE,,,,,=,168,,,,,,,,,,,,,,,2024-03-18T22:59:21.642Z
7e38987a-b1c4-4907-8037-80a81f913e1b,Google_114632842198855839133,California,16,South Bay,3/3/2024,11:00:00 AM,2024-03-03T18:00:00.000Z,CC,94,Ballona Marsh- Jefferson Inlet,33.971001,-118.431,,55,Partly_Cloudy,TRUE,,,6,SW,=,120,,,,,,,,,,,,,,,2024-03-04T23:07:54.858Z
e58b9621-1027-40f1-a96e-cec5a965ee04,Google_114632842198855839133,California,16,South Bay,2/18/2024,11:00:00 AM,2024-02-18T18:00:00.000Z,CC,94,Ballona Marsh- Jefferson Inlet,33.971001,-118.431,59,55,Partly_Cloudy,FALSE,,,,,=,86,,,,,,,,,,,,,,,2024-02-20T01:32:46.122Z
f4963e8d-aaf3-456b-826e-0d33db3757a5,Google_114632842198855839133,California,16,South Bay,1/21/2024,11:00:00 AM,2024-01-21T18:00:00.000Z,CC,94,Ballona Marsh- Jefferson Inlet,33.971001,-118.431,,61,Partly_Cloudy,TRUE,,,,,=,6488,,,,,critters swimming in sample; trash on surface of water,,,,,,,,,,2024-01-23T00:20:23.782Z
f65b7324-d59c-432d-8c06-db56062779c3,Google_101636539682545301424,California,16,South Bay,1/7/2024,11:00:00 AM,2024-01-07T18:00:00.000Z,CC,94,Ballona Marsh- Jefferson Inlet,33.971001,-118.431,,55,Sunny,FALSE,,,8,NW,=,9208,,,,,,,,,,,,,,,2024-01-09T02:07:08.821Z
d5326933-64ab-4cc8-97aa-42d1561e8c1f,Google_101636539682545301424,California,16,South Bay,12/17/2023,11:00:00 AM,2023-12-17T18:00:00.000Z,CC,94,Ballona Marsh- Jefferson Inlet,33.971001,-118.431,,73,Partly_Cloudy,FALSE,,,,,=,383,,,,,,,,,,,,,,,2023-12-19T02:21:55.528Z
15e06339-b447-4e6d-9d22-d0f06348c6ea,Google_101636539682545301424,California,16,South Bay,12/3/2023,10:30:00 AM,2023-12-03T17:30:00.000Z,CC,94,Ballona Marsh- Jefferson Inlet,33.971001,-118.431,,65,Sunny,FALSE,,,,,=,191,,,,,,,,,,,,,,,2023-12-05T01:08:29.629Z
bc9a3fdd-755e-4986-b0cf-1569aadeeda3,Google_101636539682545301424,California,16,South Bay,11/19/2023,10:30:00 AM,2023-11-19T17:30:00.000Z,CC,94,Ballona Marsh- Jefferson Inlet,33.971001,-118.431,,68,Sunny,TRUE,,,,,=,411,,,,,,,,,,,,,,,2023-11-20T23:49:47.448Z
3357c130-7d38-4192-90d1-38805a3860e8,Google_101636539682545301424,California,16,South Bay,11/5/2023,11:00:00 AM,2023-11-05T18:00:00.000Z,CC,94,Ballona Marsh- Jefferson Inlet,33.971001,-118.431,,68,Sunny,FALSE,,,,,=,135,,,,,,,,,,,,,,,2023-11-06T23:06:47.477Z
70da2b74-f961-4b77-82e7-58c9143e5a41,Google_101636539682545301424,California,16,South Bay,10/22/2023,10:00:00 AM,2023-10-22T17:00:00.000Z,CC,94,Ballona Marsh- Jefferson Inlet,33.971001,-118.431,,70,Sunny,FALSE,,,,,=,41,,,,,,,,,,,,,,,2023-10-23T23:49:53.383Z
d4f0a42d-7ff9-4a1c-b9de-2ce86e08dc66,Google_101636539682545301424,California,16,South Bay,10/8/2023,10:00:00 AM,2023-10-08T17:00:00.000Z,CC,94,Ballona Marsh- Jefferson Inlet,33.971001,-118.431,,66,Overcast,FALSE,,,,,=,74,,,,,,,,,,,,,,,2023-10-09T23:08:04.957Z
93442760-bed2-4555-80d6-ee6407791b32,Google_117493629236158511870,California,16,South Bay,5/14/2023,10:30:00 AM,2023-05-14T17:30:00.000Z,CC,94,Ballona Marsh- Jefferson Inlet,33.971001,-118.431,,66,Overcast,FALSE,,,,,=,226,,,,,,,,,,,,,,,2023-05-16T00:38:10.364Z
d6299e36-9be1-41c0-8aca-b96c9e7a0aa9,Google_101636539682545301424,California,16,South Bay,4/30/2023,10:50:00 AM,2023-04-30T17:50:00.000Z,CC,94,Ballona Marsh- Jefferson Inlet,33.971001,-118.431,,57,Overcast,FALSE,,,,,=,386,,,,,,,,,,,,,,,2023-05-01T22:53:14.828Z
a12f4972-93b7-4668-a2e6-d8a35d64677f,Google_101636539682545301424,California,16,South Bay,4/16/2023,10:30:00 AM,2023-04-16T17:30:00.000Z,CC,94,Ballona Marsh- Jefferson Inlet,33.971001,-118.431,,57,Partly_Cloudy,FALSE,,,4,W,=,85,,,,,,,,,,,,,,,2023-04-17T23:14:00.473Z
d1e3dc09-a2a7-476b-8b48-8342a23c0afc,Google_101636539682545301424,California,16,South Bay,4/2/2023,11:00:00 AM,2023-04-02T18:00:00.000Z,CC,94,Ballona Marsh- Jefferson Inlet,33.971001,-118.431,,62,Partly_Cloudy,FALSE,,,3,W,=,1616,,,,,very wet and muddy,,,,,,,,,,2023-04-03T23:13:02.959Z
8abf4d18-01df-46d5-a7c2-c7829fdb7c77,Google_101636539682545301424,California,16,South Bay,3/19/2023,10:30:00 AM,2023-03-19T17:30:00.000Z,CC,94,Ballona Marsh- Jefferson Inlet,33.971001,-118.431,,60,Light_Rain,TRUE,,,3,SW,=,301,,,,,"very muddy
MPN 259, 301 QC lab dup",,,,,,,,,,2023-03-20T21:52:43.998Z
5d90fb11-5360-4416-b535-d162149684d3,Google_101636539682545301424,California,16,South Bay,3/5/2023,11:00:00 AM,2023-03-05T18:00:00.000Z,CC,94,Ballona Marsh- Jefferson Inlet,33.971001,-118.431,,52,Light_Rain,TRUE,,,,,=,771,,,,,,,,,,,,,,,2023-03-06T22:51:54.139Z
942bec8b-54e6-4cce-b054-b66870019d51,Google_101636539682545301424,California,16,South Bay,2/19/2023,11:00:00 AM,2023-02-19T18:00:00.000Z,CC,94,Ballona Marsh- Jefferson Inlet,33.971001,-118.431,,61,Sunny,FALSE,,,,,=,20,,,,,,,,,,,,,,,2023-02-20T22:21:32.331Z
b7f4d7fd-0d3c-41c3-a707-95353d276c6c,Google_101636539682545301424,California,16,South Bay,2/5/2023,11:00:00 AM,2023-02-05T18:00:00.000Z,CC,94,Ballona Marsh- Jefferson Inlet,33.971001,-118.431,,60,Partly_Cloudy,FALSE,,,10,W,=,171,,,,,1A clearer than normal with no trash evident,,,,,,,,,,2023-02-07T00:18:01.207Z
9c8bf43a-5ee0-42ee-90a0-e6561da90300,Google_101636539682545301424,California,16,South Bay,1/22/2023,11:00:00 AM,2023-01-22T18:00:00.000Z,CC,94,Ballona Marsh- Jefferson Inlet,33.971001,-118.431,,57,Sunny,TRUE,,,,,=,537,,,,,low flow out of marsh,,,,,,,,,,2023-01-24T00:55:09.702Z
c254a8ed-645e-4ee7-8ba8-208e50c30467,Google_101636539682545301424,California,16,South Bay,1/8/2023,11:00:00 AM,2023-01-08T18:00:00.000Z,CC,94,Ballona Marsh- Jefferson Inlet,33.971001,-118.431,,63,Partly_Cloudy,TRUE,,,,,=,2382,,,,,"Strong storm last week, King Tide 835AM 6 Jan. Visible coastal erosion, Life guard towers moved in Hermosa beach to escape surf, High surf.",,,,,,,,,,2023-01-09T23:14:02.980Z
ea59515f-d960-4582-802f-60809a8a0934,Google_101636539682545301424,California,16,South Bay,12/18/2022,11:30:00 AM,2022-12-18T18:30:00.000Z,CC,94,Ballona Marsh- Jefferson Inlet,33.971001,-118.431,,64,Sunny,FALSE,,,,,=,981,,,,,Dead squirrel in water,,,,,,,,,,2022-12-20T17:04:58.041Z
65a80cc1-a1f2-405a-9bf8-084bdea83d84,Google_101636539682545301424,California,16,South Bay,12/4/2022,12:00:00 PM,2022-12-04T19:00:00.000Z,CC,94,Ballona Marsh- Jefferson Inlet,33.971001,-118.431,,62,Partly_Cloudy,TRUE,,,,,=,5794,,,,,,,,,,,,,,,2022-12-06T20:20:48.950Z
4e5eb835-50cc-440a-b078-ff34bbe4706a,Google_101636539682545301424,California,16,South Bay,11/20/2022,12:00:00 PM,2022-11-20T19:00:00.000Z,CC,94,Ballona Marsh- Jefferson Inlet,33.971001,-118.431,,65,Sunny,FALSE,,,,,=,223,,,,,water not as visibly dirty as last few times,,,,,,,,,,2022-11-21T22:49:40.262Z
c12b44aa-918f-4b8f-b317-12c555cb2f4c,Google_101636539682545301424,California,16,South Bay,11/6/2022,12:00:00 PM,2022-11-06T19:00:00.000Z,CC,94,Ballona Marsh- Jefferson Inlet,33.971001,-118.431,,66,Sunny,FALSE,,,8,W,=,420,,,,,"brown and green materials (vegetation, etc.) floating in water
Marsh outlet- water flowing backwards (because of wind?)",,,,,,,,,,2022-11-08T01:45:12.774Z
8b934d5d-461b-4c98-920e-8d1a49c1d658,Google_101636539682545301424,California,16,South Bay,10/23/2022,10:00:00 AM,2022-10-23T17:00:00.000Z,CC,94,Ballona Marsh- Jefferson Inlet,33.971001,-118.431,,67,Sunny,FALSE,,,,,=,10,,,,,water at1B brown,,,,,,,,,,2022-10-24T23:31:42.689Z
94101757-63ed-47f4-b93e-9342fcc941f1,Google_101636539682545301424,California,16,South Bay,10/9/2022,11:00:00 AM,2022-10-09T18:00:00.000Z,CC,94,Ballona Marsh- Jefferson Inlet,33.971001,-118.431,,68,Overcast,FALSE,,,4,SW,=,1515,,,,,NO FLOW OUT OF FRESHWATER MARSH,,,,,,,,,,2022-10-10T21:22:06.016Z
92837968-8930-465e-8cda-9c5301d57677,Google_101636539682545301424,California,16,South Bay,9/25/2022,11:00:00 AM,2022-09-25T18:00:00.000Z,CC,94,Ballona Marsh- Jefferson Inlet,33.971001,-118.431,,76,Sunny,FALSE,,,2,SW,=,132,,,,,algae growing everywhere,,,,,,,,,,2022-09-26T21:53:44.490Z
59b7c00c-27f3-4a54-bc6e-a21177aa282f,Google_101636539682545301424,California,16,South Bay,5/1/2022,10:30:00 AM,2022-05-01T17:30:00.000Z,CC,94,Ballona Marsh- Jefferson Inlet,33.971001,-118.431,,65,Sunny,FALSE,,,,,=,63,,,,,,,,,,,,,,,2022-05-02T20:49:58.485Z
c43fc9bd-ab76-4c77-a498-41917e3f20ad,Google_101636539682545301424,California,16,South Bay,4/3/2022,10:30:00 AM,2022-04-03T17:30:00.000Z,CC,94,Ballona Marsh- Jefferson Inlet,33.971001,-118.431,59,57,Sunny,FALSE,,,6,SW,=,226,,,,,,,,,,,,,,,2022-04-05T00:30:54.421Z
906f598f-62a3-4bc9-8f41-aa9ddba24762,Google_101636539682545301424,California,16,South Bay,3/20/2022,10:30:00 AM,2022-03-20T17:30:00.000Z,CC,94,Ballona Marsh- Jefferson Inlet,33.971001,-118.431,58,59,Sunny,TRUE,,,7,W,=,85,,,,,"RAINED   0.03-0.06 "" between 10pm 19 March and 4am 20 March in the Redondo and Hermosa Beach areas. Marina Del Rey only 0.01"", Palos Verdes 0.17"", so  Southern Santa Monica Bay got more precipitation. ",,,,,,,,,,2022-03-21T21:31:35.248Z
f39c02c2-3c41-49b8-a482-fb0302738089,Google_101636539682545301424,California,16,South Bay,3/6/2022,11:00:00 AM,2022-03-06T18:00:00.000Z,CC,94,Ballona Marsh- Jefferson Inlet,33.971001,-118.431,57,60,Sunny,FALSE,,,5,W,=,197,,,,,"Previous two days had winds up to 25 MPH with gusts of 30MPH; generally W, but sometimes E",,,,,,,,,,2022-03-08T00:29:30.966Z
a9c22f52-c9dc-40b8-baa8-08068f8d7512,Google_101636539682545301424,California,16,South Bay,2/20/2022,11:30:00 AM,2022-02-20T18:30:00.000Z,CC,94,Ballona Marsh- Jefferson Inlet,33.971001,-118.431,,55,Partly_Cloudy,FALSE,,,,,=,30,,,,,,,,,,,,,,,2022-02-22T01:33:00.791Z
3a196f4d-6658-4b67-8c4c-01de65b09aa3,Google_101636539682545301424,California,16,South Bay,2/7/2022,11:00:00 AM,2022-02-07T18:00:00.000Z,"CC, DT",94,Ballona Marsh- Jefferson Inlet,33.971001,-118.431,,70,Sunny,FALSE,,,3,E,=,156,,,,,FLOW REVERSED AT 1A???????,,,,,,,,,,2022-02-07T22:09:24.573Z
caaf3536-b29f-4a81-a019-f477304e5d2f,Google_101636539682545301424,California,16,South Bay,1/23/2022,11:00:00 AM,2022-01-23T18:00:00.000Z,CC,94,Ballona Marsh- Jefferson Inlet,33.971001,-118.431,,71,Sunny,FALSE,,,,,=,168,,,,,"RAN TWO LAB QC- FIRST SAMPLE FROM MIDDLE OF WHIRL PAK, 168 MPN; TOOK SECOND SAMPLE FROM TOP OF WHIRL PAK, 142 MPN; THIRD FROM BOTTOM 121 MPN.  ALL WITHIN 95% CONFIDENCE PARAMETERS. TOOK SPECIAL ACCESS SAMPLE AS TEST FROM INSIDE OPEN MANHOLE COVER LEADING INTO 1A 52 MPN",,,,,,,,,,2022-01-24T23:03:03.960Z
f918a21d-7743-4daa-a8b5-969a2b632925,Google_101636539682545301424,California,16,South Bay,12/19/2021,12:00:00 PM,2021-12-19T19:00:00.000Z,CC,94,Ballona Marsh- Jefferson Inlet,33.971001,-118.431,,65,Sunny,FALSE,,,,,=,309,,,,,"QC SAMPLES MPN 256, 309",,,,,,,,,,2021-12-20T23:22:29.497Z
eebd9ef3-6389-49bd-bd15-c309cbd87339,Google_101636539682545301424,California,16,South Bay,12/5/2021,11:00:00 AM,2021-12-05T18:00:00.000Z,CC,94,Ballona Marsh- Jefferson Inlet,33.971001,-118.431,,65,Sunny,FALSE,,,,,=,488,,,,,"Trash, homeless people everywhere (sign says it will be cleaned up soon)",,,,,,,,,,2021-12-07T02:15:50.566Z
501d72ea-d032-48f5-b769-a10ea97c517c,Google_101636539682545301424,California,16,South Bay,11/21/2021,11:30:00 PM,2021-11-22T06:30:00.000Z,CC,94,Ballona Marsh- Jefferson Inlet,33.971001,-118.431,,75,Sunny,FALSE,,,,,=,2723,,,,,"HOMELESS PEOPLE INCREASED FROM LAST TIME, TRASH",,,,,,,,,,2021-11-22T21:10:05.012Z
4246a640-e7f7-4076-9af8-3bae06b6704f,Google_101636539682545301424,California,16,South Bay,11/7/2021,12:00:00 PM,2021-11-07T19:00:00.000Z,CC,94,Ballona Marsh- Jefferson Inlet,33.971001,-118.431,,60,Fog,FALSE,,,,,=,272,,,,,"LOTS OF RUBBISH, HOMELESS ENCAMPMENT",,,,,,,,,,2021-11-08T21:17:09.215Z
1d73e40f-a480-484a-b531-24fd40f78f4e,Google_101636539682545301424,California,16,South Bay,10/24/2021,10:00:00 AM,2021-10-24T17:00:00.000Z,CC,94,Ballona Marsh- Jefferson Inlet,33.971001,-118.431,,67,Sunny,FALSE,,,,,=,561,,,,,"Lots of trash, homeless encampments
",,,,,,,,,,2021-10-25T22:55:32.635Z
a8b46b20-47e2-4482-a74b-e80633acf98b,Google_101636539682545301424,California,16,South Bay,10/10/2021,10:00:00 AM,2021-10-10T17:00:00.000Z,CC,94,Ballona Marsh- Jefferson Inlet,33.971001,-118.431,,68,Sunny,FALSE,,,,,=,408,,,,,,,,,,,,,,,2021-10-11T22:36:46.580Z
553114390,Import from legacy BWTF database,California,16,South Bay,2/9/2020,12:30:00 PM,2020-02-09T19:30:00Z,C,94,Ballona Marsh- Jefferson Inlet,33.971001,-118.431,,55,Partly_Cloudy,FALSE,,Not Applicable ft,,,=,74,,,,, ,,,,,,,,,,2020-03-09T18:48:45.000Z
553114054,Import from legacy BWTF database,California,16,South Bay,1/26/2020,12:30:00 PM,2020-01-26T19:30:00Z,C,94,Ballona Marsh- Jefferson Inlet,33.971001,-118.431,58,55,Partly_Cloudy,FALSE,,Not Applicable ft,,,=,52,,,,, ,,,,,,,,,,2020-03-09T18:48:43.000Z
553113690,Import from legacy BWTF database,California,16,South Bay,1/12/2020,12:30:00 PM,2020-01-12T19:30:00Z,C,94,Ballona Marsh- Jefferson Inlet,33.971001,-118.431,63,55,Sunny,FALSE,,Not Applicable ft,,,=,62,,,,, ,,,,,,,,,,2020-03-09T18:48:41.000Z
553113185,Import from legacy BWTF database,California,16,South Bay,12/15/2019,12:30:00 PM,2019-12-15T19:30:00Z,C,94,Ballona Marsh- Jefferson Inlet,33.971001,-118.431,63,55,Sunny,FALSE,,Not Applicable ft,,,=,1887,,,,, ,,,,,,,,,,2020-03-09T18:48:38.000Z
553112834,Import from legacy BWTF database,California,16,South Bay,12/1/2019,12:30:00 PM,2019-12-01T19:30:00Z,C,94,Ballona Marsh- Jefferson Inlet,33.971001,-118.431,63,55,Overcast,TRUE,,Not Applicable ft,,,=,520,,,,, ,,,,,,,,,,2020-03-09T18:48:36.000Z
553112479,Import from legacy BWTF database,California,16,South Bay,11/17/2019,12:30:00 PM,2019-11-17T19:30:00Z,C,94,Ballona Marsh- Jefferson Inlet,33.971001,-118.431,63,85,Sunny,FALSE,medium,Not Applicable ft,,,=,1259,,,,, ,,,,,,,,,,2020-03-09T18:48:34.000Z
553112130,Import from legacy BWTF database,California,16,South Bay,11/3/2019,12:30:00 PM,2019-11-03T19:30:00Z,Craig C.,94,Ballona Marsh- Jefferson Inlet,33.971001,-118.431,73,75,Sunny,TRUE,,Not Applicable ft,,,=,52,,,,,Water surface covered with tiny plants,,,,,,,,,,2020-03-09T18:48:32.000Z
553111836,Import from legacy BWTF database,California,16,South Bay,10/20/2019,11:30:00 AM,2019-10-20T18:30:00Z,C,94,Ballona Marsh- Jefferson Inlet,33.971001,-118.431,73,75,Sunny,FALSE,,Not Applicable ft,,,=,201,,,,,PLANTS,,,,,,,,,,2020-03-09T18:48:30.000Z
553111605,Import from legacy BWTF database,California,16,South Bay,10/6/2019,11:30:00 AM,2019-10-06T18:30:00Z,C,94,Ballona Marsh- Jefferson Inlet,33.971001,-118.431,73,75,Sunny,FALSE,,Not Applicable ft,,,=,602,,,,, ,,,,,,,,,,2020-03-09T18:48:29.000Z
553108598,Import from legacy BWTF database,California,16,South Bay,5/19/2019,11:30:00 AM,2019-05-19T18:30:00Z,C,94,Ballona Marsh- Jefferson Inlet,33.971001,-118.431,58,55,Overcast,TRUE,,Not Applicable ft,,,=,10462,,,,, ,,,,,,,,,,2020-03-09T18:47:01.000Z
553108206,Import from legacy BWTF database,California,16,South Bay,5/5/2019,11:30:00 AM,2019-05-05T18:30:00Z,C,94,Ballona Marsh- Jefferson Inlet,33.971001,-118.431,63,65,Partly_Cloudy,FALSE,,Not Applicable ft,,,=,10,,,,, ,,,,,,,,,,2020-03-09T18:46:58.000Z
553108064,Import from legacy BWTF database,California,16,South Bay,4/28/2019,11:30:00 AM,2019-04-28T18:30:00Z,C,94,Ballona Marsh- Jefferson Inlet,33.971001,-118.431,68,55,Overcast,FALSE,,Not Applicable ft,,,=,41,,,,, ,,,,,,,,,,2020-03-09T18:46:58.000Z
553107932,Import from legacy BWTF database,California,16,South Bay,4/14/2019,11:30:00 AM,2019-04-14T18:30:00Z,C,94,Ballona Marsh- Jefferson Inlet,33.971001,-118.431,68,65,Partly_Cloudy,TRUE,,Not Applicable ft,,,=,31,,,,, ,,,,,,,,,,2020-03-09T18:46:57.000Z
553107324,Import from legacy BWTF database,California,16,South Bay,3/24/2019,11:30:00 AM,2019-03-24T18:30:00Z,C,94,Ballona Marsh- Jefferson Inlet,33.971001,-118.431,63,65,Partly_Cloudy,FALSE,low,Not Applicable ft,,,=,275,,,,, ,,,,,,,,,,2020-03-09T18:46:53.000Z
553107086,Import from legacy BWTF database,California,16,South Bay,3/10/2019,11:30:00 AM,2019-03-10T18:30:00Z,C,94,Ballona Marsh- Jefferson Inlet,33.971001,-118.431,58,55,Partly_Cloudy,FALSE,,Not Applicable ft,,,=,41,,,,, ,,,,,,,,,,2020-03-09T18:46:52.000Z
553106748,Import from legacy BWTF database,California,16,South Bay,2/24/2019,12:30:00 PM,2019-02-24T19:30:00Z,C,94,Ballona Marsh- Jefferson Inlet,33.971001,-118.431,63,55,Sunny,FALSE,,Not Applicable ft,,,=,30,,,,, ,,,,,,,,,,2020-03-09T18:46:50.000Z
553106575,Import from legacy BWTF database,California,16,South Bay,2/10/2019,12:30:00 PM,2019-02-10T19:30:00Z,C,94,Ballona Marsh- Jefferson Inlet,33.971001,-118.431,58,55,Partly_Cloudy,TRUE,medium,Not Applicable ft,,,=,24195,,,,, ,,,,,,,,,,2020-03-09T18:46:49.000Z
553106142,Import from legacy BWTF database,California,16,South Bay,1/27/2019,12:30:00 PM,2019-01-27T19:30:00Z,C,94,Ballona Marsh- Jefferson Inlet,33.971001,-118.431,63,65,Partly_Cloudy,FALSE,medium,Not Applicable ft,,,=,626,,,,, ,,,,,,,,,,2020-03-09T18:46:47.000Z
553105922,Import from legacy BWTF database,California,16,South Bay,1/13/2019,11:30:00 AM,2019-01-13T18:30:00Z,Craig C,94,Ballona Marsh- Jefferson Inlet,33.971001,-118.431,58,55,Partly_Cloudy,TRUE,low,Not Applicable ft,,,=,8297,,,,, ,,,,,,,,,,2020-03-09T18:46:45.000Z
553105399,Import from legacy BWTF database,California,16,South Bay,12/16/2018,11:30:00 AM,2018-12-16T18:30:00Z,Craig C.,94,Ballona Marsh- Jefferson Inlet,33.971001,-118.431,58,65,Partly_Cloudy,FALSE,medium,Not Applicable ft,,,>,24196,,,,, ,,,,,,,,,,2020-03-09T18:46:43.000Z
553105056,Import from legacy BWTF database,California,16,South Bay,12/2/2018,11:30:00 AM,2018-12-02T18:30:00Z,Craig C.,94,Ballona Marsh- Jefferson Inlet,33.971001,-118.431,63,65,Partly_Cloudy,TRUE,low,Not Applicable ft,,,=,1203,,,,, ,,,,,,,,,,2020-03-09T18:46:41.000Z
553104651,Import from legacy BWTF database,California,16,South Bay,11/18/2018,11:30:00 AM,2018-11-18T18:30:00Z,Craig C.,94,Ballona Marsh- Jefferson Inlet,33.971001,-118.431,68,65,Partly_Cloudy,FALSE,medium,Not Applicable ft,,,=,388,,,,, ,,,,,,,,,,2020-03-09T18:46:38.000Z
553104360,Import from legacy BWTF database,California,16,South Bay,11/4/2018,11:30:00 AM,2018-11-04T18:30:00Z,Craig C.,94,Ballona Marsh- Jefferson Inlet,33.971001,-118.431,68,65,Fog,FALSE,low,Not Applicable ft,,,=,1510,,,,, ,,,,,,,,,,2020-03-09T18:46:37.000Z
553104114,Import from legacy BWTF database,California,16,South Bay,10/21/2018,9:30:00 AM,2018-10-21T16:30:00Z,Craig C.,94,Ballona Marsh- Jefferson Inlet,33.971001,-118.431,68,65,Sunny,FALSE,medium,Not Applicable ft,,,=,6488,,,,, ,,,,,,,,,,2020-03-09T18:46:35.000Z
553103790,Import from legacy BWTF database,California,16,South Bay,10/7/2018,8:30:00 AM,2018-10-07T15:30:00Z,Craig C.,94,Ballona Marsh- Jefferson Inlet,33.971001,-118.431,68,65,Sunny,TRUE,high,Not Applicable ft,,,=,24195,,,,, ,,,,,,,,,,2020-03-09T18:46:33.000Z
553101153,Import from legacy BWTF database,California,16,South Bay,5/13/2018,10:30:00 AM,2018-05-13T17:30:00Z,Craig C.,94,Ballona Marsh- Jefferson Inlet,33.971001,-118.431,58,65,Sunny,FALSE,high,Not Applicable ft,,,=,1092,,,,, ,,,,,,,,,,2020-03-09T18:46:18.000Z
553100429,Import from legacy BWTF database,California,16,South Bay,4/8/2018,10:30:00 AM,2018-04-08T17:30:00Z,Craig C.,94,Ballona Marsh- Jefferson Inlet,33.971001,-118.431,58,65,Sunny,FALSE,high,Not Applicable ft,,,=,62,,,,, ,,,,,,,,,,2020-03-09T18:45:41.000Z
553099756,Import from legacy BWTF database,California,16,South Bay,3/18/2018,10:30:00 AM,2018-03-18T17:30:00Z,Craig C.,94,Ballona Marsh- Jefferson Inlet,33.971001,-118.431,58,55,Partly_Cloudy,TRUE,high,Not Applicable ft,,,=,12033,,,,, ,,,,,,,,,,2020-03-09T18:45:37.000Z
553099460,Import from legacy BWTF database,California,16,South Bay,3/4/2018,11:30:00 AM,2018-03-04T18:30:00Z,Craig C.,94,Ballona Marsh- Jefferson Inlet,33.971001,-118.431,58,55,Partly_Cloudy,TRUE,high,Not Applicable ft,,,=,683,,,,, ,,,,,,,,,,2020-03-09T18:45:35.000Z
553099194,Import from legacy BWTF database,California,16,South Bay,2/18/2018,10:30:00 AM,2018-02-18T17:30:00Z,Craig C.,94,Ballona Marsh- Jefferson Inlet,33.971001,-118.431,58,65,Sunny,FALSE,high,Not Applicable ft,,,=,397,,,,, ,,,,,,,,,,2020-03-09T18:45:34.000Z
553098939,Import from legacy BWTF database,California,16,South Bay,2/5/2018,12:30:00 PM,2018-02-05T19:30:00Z,Craig C.,94,Ballona Marsh- Jefferson Inlet,33.971001,-118.431,58,65,Partly_Cloudy,FALSE,high,Not Applicable ft,,,=,1936,,,,, ,,,,,,,,,,2020-03-09T18:45:32.000Z
553098716,Import from legacy BWTF database,California,16,South Bay,1/22/2018,12:30:00 PM,2018-01-22T19:30:00Z,Craig C.,94,Ballona Marsh- Jefferson Inlet,33.971001,-118.431,58,65,Partly_Cloudy,TRUE,high,Not Applicable ft,,,=,573,,,,, ,,,,,,,,,,2020-03-09T18:45:31.000Z
553098430,Import from legacy BWTF database,California,16,South Bay,1/7/2018,11:30:00 AM,2018-01-07T18:30:00Z,Craig C.,94,Ballona Marsh- Jefferson Inlet,33.971001,-118.431,58,65,Partly_Cloudy,FALSE,low,Not Applicable ft,,,=,325,,,,, ,,,,,,,,,,2020-03-09T18:45:29.000Z
553098084,Import from legacy BWTF database,California,16,South Bay,12/10/2017,11:30:00 AM,2017-12-10T18:30:00Z,Craig C.,94,Ballona Marsh- Jefferson Inlet,33.971001,-118.431,58,75,Sunny,FALSE,low,Not Applicable ft,,,=,3441,,,,, ,,,,,,,,,,2020-03-09T18:45:27.000Z
553097684,Import from legacy BWTF database,California,16,South Bay,11/19/2017,11:30:00 AM,2017-11-19T18:30:00Z,Craig C.,94,Ballona Marsh- Jefferson Inlet,33.971001,-118.431,63,65,Sunny,FALSE,high,Not Applicable ft,,,=,238,,,,, ,,,,,,,,,,2020-03-09T18:45:25.000Z
553097326,Import from legacy BWTF database,California,16,South Bay,11/5/2017,11:30:00 AM,2017-11-05T18:30:00Z,Craig C.,94,Ballona Marsh- Jefferson Inlet,33.971001,-118.431,68,65,,TRUE,high,Not Applicable ft,,,=,534,,,,, ,,,,,,,,,,2020-03-09T18:45:23.000Z
553097103,Import from legacy BWTF database,California,16,South Bay,10/22/2017,9:30:00 AM,2017-10-22T16:30:00Z,Craig C.,94,Ballona Marsh- Jefferson Inlet,33.971001,-118.431,68,75,,FALSE,high,Not Applicable ft,,,=,6485,,,,, ,,,,,,,,,,2020-03-09T18:45:22.000Z
553096866,Import from legacy BWTF database,California,16,South Bay,10/2/2017,10:30:00 AM,2017-10-02T17:30:00Z,Craig C.,94,Ballona Marsh- Jefferson Inlet,33.971001,-118.431,68,65,Sunny,FALSE,high,Not Applicable ft,,,=,10462,,,,, ,,,,,,,,,,2020-03-09T18:45:21.000Z
553094190,Import from legacy BWTF database,California,16,South Bay,4/23/2017,10:30:00 AM,2017-04-23T17:30:00Z,Craig C.,94,Ballona Marsh- Jefferson Inlet,33.971001,-118.431,63,65,Sunny,FALSE,high,Not Applicable ft,,,=,1354,,,,, ,,,,,,,,,,2020-03-09T18:45:06.000Z
553093937,Import from legacy BWTF database,California,16,South Bay,4/9/2017,10:30:00 AM,2017-04-09T17:30:00Z,Craig C.,94,Ballona Marsh- Jefferson Inlet,33.971001,-118.431,58,55,Sunny,TRUE,high,Not Applicable ft,,,=,9606,,,,, ,,,,,,,,,,2020-03-09T18:45:04.000Z
553093710,Import from legacy BWTF database,California,16,South Bay,3/26/2017,10:30:00 AM,2017-03-26T17:30:00Z,Craig C.,94,Ballona Marsh- Jefferson Inlet,33.971001,-118.431,58,55,Partly_Cloudy,FALSE,high,Not Applicable ft,,,=,61,,,,, ,,,,,,,,,,2020-03-09T18:45:03.000Z
553093517,Import from legacy BWTF database,California,16,South Bay,3/12/2017,10:30:00 AM,2017-03-12T17:30:00Z,Craig C.,94,Ballona Marsh- Jefferson Inlet,33.971001,-118.431,58,55,Overcast,FALSE,high,Not Applicable ft,,,=,52,,,,, ,,,,,,,,,,2020-03-09T18:45:02.000Z
553093198,Import from legacy BWTF database,California,16,South Bay,2/26/2017,11:30:00 AM,2017-02-26T18:30:00Z,Craig C.,94,Ballona Marsh- Jefferson Inlet,33.971001,-118.431,58,55,Light_Rain,TRUE,high,Not Applicable ft,,,=,985,,,,, ,,,,,,,,,,2020-03-09T18:45:00.000Z
553093015,Import from legacy BWTF database,California,16,South Bay,2/12/2017,11:30:00 AM,2017-02-12T18:30:00Z,Craig C.,94,Ballona Marsh- Jefferson Inlet,33.971001,-118.431,58,55,Partly_Cloudy,TRUE,high,Not Applicable ft,,,=,216,,,,, ,,,,,,,,,,2020-03-09T18:44:59.000Z
553092629,Import from legacy BWTF database,California,16,South Bay,1/22/2017,11:30:00 AM,2017-01-22T18:30:00Z,Craig C.,94,Ballona Marsh- Jefferson Inlet,33.971001,-118.431,58,55,Heavy_Rain,TRUE,medium,Not Applicable ft,,,=,5600,,,,, ,,,,,,,,,,2020-03-09T18:44:57.000Z
553092411,Import from legacy BWTF database,California,16,South Bay,1/8/2017,11:30:00 AM,2017-01-08T18:30:00Z,Craig C.,94,Ballona Marsh- Jefferson Inlet,33.971001,-118.431,58,65,Partly_Cloudy,TRUE,low,Not Applicable ft,,,=,675,,,,, ,,,,,,,,,,2020-03-09T18:44:55.000Z
553091917,Import from legacy BWTF database,California,16,South Bay,12/4/2016,11:30:00 AM,2016-12-04T18:30:00Z,Craig C.,94,Ballona Marsh- Jefferson Inlet,33.971001,-118.431,58,55,Sunny,FALSE,medium,Not Applicable ft,,,=,393,,,,, ,,,,,,,,,,2020-03-09T18:44:53.000Z
553091724,Import from legacy BWTF database,California,16,South Bay,11/20/2016,11:30:00 AM,2016-11-20T18:30:00Z,Craig C.,94,Ballona Marsh- Jefferson Inlet,33.971001,-118.431,68,65,Light_Rain,TRUE,medium,Not Applicable ft,,,=,93,,,,, ,,,,,,,,,,2020-03-09T18:44:52.000Z
553091404,Import from legacy BWTF database,California,16,South Bay,11/6/2016,11:30:00 AM,2016-11-06T18:30:00Z,Craig,94,Ballona Marsh- Jefferson Inlet,33.971001,-118.431,63,65,Fog,FALSE,medium,Not Applicable ft,,,=,1935,,,,, ,,,,,,,,,,2020-03-09T18:44:50.000Z
553090980,Import from legacy BWTF database,California,16,South Bay,10/9/2016,10:30:00 AM,2016-10-09T17:30:00Z,Craig,94,Ballona Marsh- Jefferson Inlet,33.971001,-118.431,68,75,Sunny,FALSE,medium,Not Applicable ft,,,=,663,,,,, ,,,,,,,,,,2020-03-09T18:44:48.000Z
553088869,Import from legacy BWTF database,California,16,South Bay,5/1/2016,10:30:00 AM,2016-05-01T17:30:00Z,Craig C.,94,Ballona Marsh- Jefferson Inlet,33.971001,-118.431,58,65,Partly_Cloudy,FALSE,low,Not Applicable ft,,,=,92,,,,, ,,,,,,,,,,2020-03-09T18:42:34.000Z
553088557,Import from legacy BWTF database,California,16,South Bay,4/15/2016,9:30:00 AM,2016-04-15T16:30:00Z,Craig C.,94,Ballona Marsh- Jefferson Inlet,33.971001,-118.431,58,65,Sunny,FALSE,high,Not Applicable ft,,,=,110,,,,, ,,,,,,,,,,2020-03-09T18:42:32.000Z
553088380,Import from legacy BWTF database,California,16,South Bay,4/3/2016,10:30:00 AM,2016-04-03T17:30:00Z,CRAIG C.,94,Ballona Marsh- Jefferson Inlet,33.971001,-118.431,58,55,Partly_Cloudy,FALSE,medium,Not Applicable ft,,,=,21,,,,, ,,,,,,,,,,2020-03-09T18:42:32.000Z
553088179,Import from legacy BWTF database,California,16,South Bay,3/20/2016,10:30:00 AM,2016-03-20T17:30:00Z,CRAIG C.,94,Ballona Marsh- Jefferson Inlet,33.971001,-118.431,58,65,Partly_Cloudy,FALSE,medium,Not Applicable ft,,,=,86,,,,, ,,,,,,,,,,2020-03-09T18:42:31.000Z
553087921,Import from legacy BWTF database,California,16,South Bay,3/6/2016,11:30:00 AM,2016-03-06T18:30:00Z,CRAIG C.,94,Ballona Marsh- Jefferson Inlet,33.971001,-118.431,58,55,Light_Rain,TRUE,high,Not Applicable ft,,,=,1169,,,,, ,,,,,,,,,,2020-03-09T18:42:29.000Z
553087490,Import from legacy BWTF database,California,16,South Bay,2/21/2016,11:30:00 AM,2016-02-21T18:30:00Z,Craig C.,94,Ballona Marsh- Jefferson Inlet,33.971001,-118.431,58,55,Sunny,FALSE,high,Not Applicable ft,,,=,122,,,,, ,,,,,,,,,,2020-03-09T18:42:28.000Z
553087337,Import from legacy BWTF database,California,16,South Bay,2/7/2016,11:30:00 AM,2016-02-07T18:30:00Z,CRAIG C.,94,Ballona Marsh- Jefferson Inlet,33.971001,-118.431,58,75,Sunny,FALSE,high,Not Applicable ft,,,=,457,,,,, ,,,,,,,,,,2020-03-09T18:42:27.000Z
553087117,Import from legacy BWTF database,California,16,South Bay,1/24/2016,11:30:00 AM,2016-01-24T18:30:00Z,Craig C.,94,Ballona Marsh- Jefferson Inlet,33.971001,-118.431,43,65,Sunny,TRUE,high,Not Applicable ft,,,=,74,,,,, ,,,,,,,,,,2020-03-09T18:42:26.000Z
553086976,Import from legacy BWTF database,California,16,South Bay,1/10/2016,11:30:00 AM,2016-01-10T18:30:00Z,CRAIG C.,94,Ballona Marsh- Jefferson Inlet,33.971001,-118.431,58,55,Partly_Cloudy,TRUE,high,Not Applicable ft,,,=,134,,,,, ,,,,,,,,,,2020-03-09T18:42:25.000Z
553086597,Import from legacy BWTF database,California,16,South Bay,12/6/2015,11:30:00 AM,2015-12-06T18:30:00Z,CRAIG C.,94,Ballona Marsh- Jefferson Inlet,33.971001,-118.431,63,65,Partly_Cloudy,FALSE,high,Not Applicable ft,,,=,2098,,,,, ,,,,,,,,,,2020-03-09T18:42:23.000Z
553086393,Import from legacy BWTF database,California,16,South Bay,11/15/2015,11:30:00 AM,2015-11-15T18:30:00Z,Craig C.,94,Ballona Marsh- Jefferson Inlet,33.971001,-118.431,63,65,Partly_Cloudy,FALSE,high,Not Applicable ft,,,=,585,,,,, ,,,,,,,,,,2020-03-09T18:42:23.000Z
553086189,Import from legacy BWTF database,California,16,South Bay,11/1/2015,11:30:00 AM,2015-11-01T18:30:00Z,Craig C.,94,Ballona Marsh- Jefferson Inlet,33.971001,-118.431,68,75,Sunny,FALSE,high,Not Applicable ft,,,=,953,,,,, ,,,,,,,,,,2020-03-09T18:42:22.000Z
553086002,Import from legacy BWTF database,California,16,South Bay,10/18/2015,10:30:00 AM,2015-10-18T17:30:00Z,Craig C.,94,Ballona Marsh- Jefferson Inlet,33.971001,-118.431,73,65,Partly_Cloudy,TRUE,high,Not Applicable ft,,,=,350,,,,, ,,,,,,,,,,2020-03-09T18:42:21.000Z
553085796,Import from legacy BWTF database,California,16,South Bay,10/4/2015,10:30:00 AM,2015-10-04T17:30:00Z,Craig C.,94,Ballona Marsh- Jefferson Inlet,33.971001,-118.431,73,65,Partly_Cloudy,TRUE,low,Not Applicable ft,,,=,494,,,,, ,,,,,,,,,,2020-03-09T18:42:20.000Z
553083693,Import from legacy BWTF database,California,16,South Bay,4/26/2015,10:30:00 AM,2015-04-26T17:30:00Z,Craig C.,94,Ballona Marsh- Jefferson Inlet,33.971001,-118.431,58,65,Sunny,TRUE,,Not Applicable ft,,,=,63,,,,, ,,,,,,,,,,2020-03-09T18:41:14.000Z
553083535,Import from legacy BWTF database,California,16,South Bay,4/12/2015,10:30:00 AM,2015-04-12T17:30:00Z,Craig C.,94,Ballona Marsh- Jefferson Inlet,33.971001,-118.431,58,65,Sunny,FALSE,low,Not Applicable ft,,,=,144,,,,, ,,,,,,,,,,2020-03-09T18:41:13.000Z
553083289,Import from legacy BWTF database,California,16,South Bay,3/22/2015,10:30:00 AM,2015-03-22T17:30:00Z,Craig C.,94,Ballona Marsh- Jefferson Inlet,33.971001,-118.431,58,75,Sunny,FALSE,high,Not Applicable ft,,,=,63,,,,, ,,,,,,,,,,2020-03-09T18:41:12.000Z
553083172,Import from legacy BWTF database,California,16,South Bay,3/8/2015,10:30:00 AM,2015-03-08T17:30:00Z,Craig C.,94,Ballona Marsh- Jefferson Inlet,33.971001,-118.431,58,65,Sunny,FALSE,high,Not Applicable ft,,,>,24196,,,,, ,,,,,,,,,,2020-03-09T18:41:11.000Z
553082853,Import from legacy BWTF database,California,16,South Bay,2/22/2015,11:30:00 AM,2015-02-22T18:30:00Z,Craig C.,94,Ballona Marsh- Jefferson Inlet,33.971001,-118.431,58,65,Light_Rain,TRUE,high,,,,=,52,,,,, ,,,,,,,,,,2020-03-09T18:41:09.000Z
553082715,Import from legacy BWTF database,California,16,South Bay,2/8/2015,11:30:00 AM,2015-02-08T18:30:00Z,Craig C.,94,Ballona Marsh- Jefferson Inlet,33.971001,-118.431,58,65,Partly_Cloudy,TRUE,low,Not Applicable ft,,,=,135,,,,, ,,,,,,,,,,2020-03-09T18:41:08.000Z
553082548,Import from legacy BWTF database,California,16,South Bay,1/25/2015,11:30:00 AM,2015-01-25T18:30:00Z,Craig C.,94,Ballona Marsh- Jefferson Inlet,33.971001,-118.431,58,75,Sunny,FALSE,low,Not Applicable ft,,,>,24196,,,,, ,,,,,,,,,,2020-03-09T18:41:06.000Z
553082211,Import from legacy BWTF database,California,16,South Bay,1/11/2015,11:30:00 AM,2015-01-11T18:30:00Z,Craig C.,94,Ballona Marsh- Jefferson Inlet,33.971001,-118.431,58,55,Light_Rain,TRUE,,Not Applicable ft,,,=,4352,,,,, ,,,,,,,,,,2020-03-09T18:41:03.000Z
553081932,Import from legacy BWTF database,California,16,South Bay,12/14/2014,11:30:00 AM,2014-12-14T18:30:00Z,Craig C.,94,Ballona Marsh- Jefferson Inlet,33.971001,-118.431,63,55,Sunny,TRUE,medium,Not Applicable ft,,,>,24196,,,,, ,,,,,,,,,,2020-03-09T18:40:50.000Z
553081725,Import from legacy BWTF database,California,16,South Bay,11/30/2014,11:30:00 AM,2014-11-30T18:30:00Z,Craig C.,94,Ballona Marsh- Jefferson Inlet,33.971001,-118.431,68,65,Partly_Cloudy,TRUE,,Not Applicable ft,,,=,273,,,,, ,,,,,,,,,,2020-03-09T18:40:49.000Z
553081558,Import from legacy BWTF database,California,16,South Bay,11/16/2014,11:30:00 AM,2014-11-16T18:30:00Z,Craig ,94,Ballona Marsh- Jefferson Inlet,33.971001,-118.431,68,65,Sunny,TRUE,low,Not Applicable ft,,,=,386,,,,, ,,,,,,,,,,2020-03-09T18:40:48.000Z
553081382,Import from legacy BWTF database,California,16,South Bay,11/2/2014,11:30:00 AM,2014-11-02T18:30:00Z,Craig,94,Ballona Marsh- Jefferson Inlet,33.971001,-118.431,68,65,Sunny,TRUE,low,Not Applicable ft,,,=,24190,,,,, ,,,,,,,,,,2020-03-09T18:40:48.000Z
553079504,Import from legacy BWTF database,California,16,South Bay,4/27/2014,10:30:00 AM,2014-04-27T17:30:00Z,Craig C.,94,Ballona Marsh- Jefferson Inlet,33.971001,-118.431,63,65,Sunny,TRUE,high,,,,=,52,,,,, ,,,,,,,,,,2020-03-09T18:40:30.000Z
553079251,Import from legacy BWTF database,California,16,South Bay,4/13/2014,11:30:00 AM,2014-04-13T18:30:00Z,Craig,94,Ballona Marsh- Jefferson Inlet,33.971001,-118.431,63,65,Partly_Cloudy,FALSE,high,Not Applicable ft,,,=,105,,,,, ,,,,,,,,,,2020-03-09T18:38:48.000Z
553079042,Import from legacy BWTF database,California,16,South Bay,3/23/2014,11:30:00 AM,2014-03-23T18:30:00Z,Craig C.,94,Ballona Marsh- Jefferson Inlet,33.971001,-118.431,63,65,Sunny,FALSE,,Not Applicable ft,,,=,41,,,,, ,,,,,,,,,,2020-03-09T18:38:42.000Z
553078796,Import from legacy BWTF database,California,16,South Bay,3/9/2014,10:30:00 AM,2014-03-09T17:30:00Z,Craig C.,94,Ballona Marsh- Jefferson Inlet,33.971001,-118.431,58,75,Sunny,FALSE,,Not Applicable ft,,,=,545,,,,, ,,,,,,,,,,2020-03-09T18:38:34.000Z
553078481,Import from legacy BWTF database,California,16,South Bay,2/9/2014,12:30:00 PM,2014-02-09T19:30:00Z,Craig C.,94,Ballona Marsh- Jefferson Inlet,33.971001,-118.431,58,65,Sunny,TRUE,,Not Applicable ft,,,=,86,,,,, ,,,,,,,,,,2020-03-09T18:38:30.000Z
553078240,Import from legacy BWTF database,California,16,South Bay,1/26/2014,12:30:00 PM,2014-01-26T19:30:00Z,Craig C.,94,Ballona Marsh- Jefferson Inlet,33.971001,-118.431,58,65,Partly_Cloudy,FALSE,,Not Applicable ft,,,=,183,,,,, ,,,,,,,,,,2020-03-09T18:38:20.000Z
553078056,Import from legacy BWTF database,California,16,South Bay,1/12/2014,12:30:00 PM,2014-01-12T19:30:00Z,Craig C.,94,Ballona Marsh- Jefferson Inlet,33.971001,-118.431,58,65,Sunny,FALSE,high,Not Applicable ft,,,=,41,,,,, ,,,,,,,,,,2020-03-09T18:38:19.000Z
553077782,Import from legacy BWTF database,California,16,South Bay,12/8/2013,12:30:00 PM,2013-12-08T19:30:00Z,Craig C.,94,Ballona Marsh- Jefferson Inlet,33.971001,-118.431,63,45,Sunny,TRUE,,Not Applicable ft,,,=,6113,,,,, ,,,,,,,,,,2020-03-09T18:38:18.000Z
553077612,Import from legacy BWTF database,California,16,South Bay,11/17/2013,11:30:00 AM,2013-11-17T18:30:00Z,Craig C.,94,Ballona Marsh- Jefferson Inlet,33.971001,-118.431,63,65,Partly_Cloudy,FALSE,,Not Applicable ft,,,=,586,,,,, ,,,,,,,,,,2020-03-09T18:38:07.000Z
553077471,Import from legacy BWTF database,California,16,South Bay,11/3/2013,12:30:00 PM,2013-11-03T19:30:00Z,Craig C.,94,Ballona Marsh- Jefferson Inlet,33.971001,-118.431,63,65,Sunny,FALSE,,Not Applicable ft,,,=,604,,,,, ,,,,,,,,,,2020-03-09T18:38:02.000Z
553077375,Import from legacy BWTF database,California,16,South Bay,10/20/2013,11:30:00 AM,2013-10-20T18:30:00Z,Craig C.,94,Ballona Marsh- Jefferson Inlet,33.971001,-118.431,63,65,Sunny,FALSE,,Not Applicable ft,,,=,144,,,,, ,,,,,,,,,,2020-03-09T18:38:02.000Z
553077165,Import from legacy BWTF database,California,16,South Bay,10/6/2013,10:30:00 AM,2013-10-06T17:30:00Z,C. Cadwallader,94,Ballona Marsh- Jefferson Inlet,33.971001,-118.431,68,85,Sunny,FALSE,,Not Applicable ft,,,=,496,,,,, ,,,,,,,,,,2020-03-09T18:38:01.000Z
553076056,Import from legacy BWTF database,California,16,South Bay,4/28/2013,10:30:00 AM,2013-04-28T17:30:00Z,C.C.,94,Ballona Marsh- Jefferson Inlet,33.971001,-118.431,58,65,Sunny,FALSE,,Not Applicable ft,,,=,216,,,,, ,,,,,,,,,,2020-03-09T18:37:56.000Z
553075937,Import from legacy BWTF database,California,16,South Bay,4/14/2013,10:30:00 AM,2013-04-14T17:30:00Z,H S Students,94,Ballona Marsh- Jefferson Inlet,33.971001,-118.431,58,65,Sunny,FALSE,,Not Applicable ft,,,=,10,,,,, ,,,,,,,,,,2020-03-09T18:37:47.000Z
553075565,Import from legacy BWTF database,California,16,South Bay,3/17/2013,10:30:00 AM,2013-03-17T17:30:00Z,student,94,Ballona Marsh- Jefferson Inlet,33.971001,-118.431,,65,Sunny,FALSE,,,,,=,401,,,,, ,,,,,,,,,,2020-03-09T18:37:46.000Z
553075355,Import from legacy BWTF database,California,16,South Bay,3/3/2013,12:30:00 PM,2013-03-03T19:30:00Z,student,94,Ballona Marsh- Jefferson Inlet,33.971001,-118.431,,,Partly_Cloudy,FALSE,,,,,=,1354,,,,, ,,,,,,,,,,2020-03-09T18:37:45.000Z
553075167,Import from legacy BWTF database,California,16,South Bay,2/17/2013,12:30:00 PM,2013-02-17T19:30:00Z,student,94,Ballona Marsh- Jefferson Inlet,33.971001,-118.431,,,Sunny,FALSE,,,,,=,1842,,,,, ,,,,,,,,,,2020-03-09T18:37:44.000Z
553074937,Import from legacy BWTF database,California,16,South Bay,2/3/2013,11:30:00 AM,2013-02-03T18:30:00Z,H S Students,94,Ballona Marsh- Jefferson Inlet,33.971001,-118.431,53,55,Sunny,FALSE,high,Not Applicable ft,,,=,41,,,,, ,,,,,,,,,,2020-03-09T18:37:39.000Z
553074810,Import from legacy BWTF database,California,16,South Bay,1/20/2013,12:30:00 PM,2013-01-20T19:30:00Z,H S Students,94,Ballona Marsh- Jefferson Inlet,33.971001,-118.431,58,65,Sunny,FALSE,,Not Applicable ft,,,=,347,,,,, ,,,,,,,,,,2020-03-09T18:37:39.000Z
553074686,Import from legacy BWTF database,California,16,South Bay,1/6/2013,11:30:00 AM,2013-01-06T18:30:00Z,HS students,94,Ballona Marsh- Jefferson Inlet,33.971001,-118.431,58,55,Light_Rain,TRUE,low,Not Applicable ft,,,=,907,,,,, ,,,,,,,,,,2020-03-09T18:37:38.000Z
553074566,Import from legacy BWTF database,California,16,South Bay,12/16/2012,12:30:00 PM,2012-12-16T19:30:00Z,student,94,Ballona Marsh- Jefferson Inlet,33.971001,-118.431,,,Light_Rain,TRUE,,,,,=,2247,,,,, ,,,,,,,,,,2020-03-09T18:37:38.000Z
553074377,Import from legacy BWTF database,California,16,South Bay,12/2/2012,12:30:00 PM,2012-12-02T19:30:00Z,student,94,Ballona Marsh- Jefferson Inlet,33.971001,-118.431,,65,Light_Rain,TRUE,,,,,=,31,,,,, ,,,,,,,,,,2020-03-09T18:37:37.000Z
553074256,Import from legacy BWTF database,California,16,South Bay,11/18/2012,12:30:00 PM,2012-11-18T19:30:00Z,Craig C.,94,Ballona Marsh- Jefferson Inlet,33.971001,-118.431,58,55,Light_Rain,TRUE,high,Not Applicable ft,,,=,4611,,,,, ,,,,,,,,,,2020-03-09T18:37:36.000Z
553074032,Import from legacy BWTF database,California,16,South Bay,11/4/2012,12:30:00 PM,2012-11-04T19:30:00Z,H S Students,94,Ballona Marsh- Jefferson Inlet,33.971001,-118.431,68,75,Sunny,FALSE,,Not Applicable ft,,,=,1956,,,,, ,,,,,,,,,,2020-03-09T18:37:02.000Z
553073916,Import from legacy BWTF database,California,16,South Bay,10/21/2012,10:30:00 AM,2012-10-21T17:30:00Z,Craig C.,94,Ballona Marsh- Jefferson Inlet,33.971001,-118.431,68,65,Partly_Cloudy,TRUE,,Not Applicable ft,,,=,2382,,,,, ,,,,,,,,,,2020-03-09T18:37:01.000Z
553073836,Import from legacy BWTF database,California,16,South Bay,10/7/2012,10:30:00 AM,2012-10-07T17:30:00Z,HS Students,94,Ballona Marsh- Jefferson Inlet,33.971001,-118.431,73,65,Sunny,FALSE,,Not Applicable ft,,,=,189,,,,, ,,,,,,,,,,2020-03-09T18:37:01.000Z
553072706,Import from legacy BWTF database,California,16,South Bay,4/30/2012,12:30:00 PM,2012-04-30T19:30:00Z,Matt Waterworth,94,Ballona Marsh- Jefferson Inlet,33.971001,-118.431,,,,,,,,,=,50,,,,, ,,,,,,,,,,2020-03-09T18:36:54.000Z
553072641,Import from legacy BWTF database,California,16,South Bay,4/16/2012,12:30:00 PM,2012-04-16T19:30:00Z,Matt Waterworth,94,Ballona Marsh- Jefferson Inlet,33.971001,-118.431,,,,,,,,,=,520,,,,, ,,,,,,,,,,2020-03-09T18:36:54.000Z
553072552,Import from legacy BWTF database,California,16,South Bay,4/1/2012,11:30:00 AM,2012-04-01T18:30:00Z,HS Students,94,Ballona Marsh- Jefferson Inlet,33.971001,-118.431,,,Sunny,TRUE,,,,,=,218,,,,, ,,,,,,,,,,2020-03-09T18:36:53.000Z
553072433,Import from legacy BWTF database,California,16,South Bay,3/19/2012,12:30:00 PM,2012-03-19T19:30:00Z,Matt Waterworth,94,Ballona Marsh- Jefferson Inlet,33.971001,-118.431,,,,,,,,,=,1860,,,,, ,,,,,,,,,,2020-03-09T18:36:53.000Z
553072202,Import from legacy BWTF database,California,16,South Bay,3/5/2012,12:30:00 PM,2012-03-05T19:30:00Z,Matt Waterworth,94,Ballona Marsh- Jefferson Inlet,33.971001,-118.431,,,,,,,,,=,51,,,,, ,,,,,,,,,,2020-03-09T18:36:47.000Z
553072100,Import from legacy BWTF database,California,16,South Bay,2/20/2012,12:30:00 PM,2012-02-20T19:30:00Z,Matt Waterworth,94,Ballona Marsh- Jefferson Inlet,33.971001,-118.431,,,,,,,,,=,94,,,,, ,,,,,,,,,,2020-03-09T18:36:46.000Z
553071773,Import from legacy BWTF database,California,16,South Bay,1/22/2012,11:30:00 AM,2012-01-22T18:30:00Z,Joe G.,94,Ballona Marsh- Jefferson Inlet,33.971001,-118.431,58,55,Light_Rain,TRUE,high,Not Applicable ft,,,=,2987,,,,,Fresh Water at wetlands,,,,,,,,,,2020-03-09T18:36:44.000Z
553071691,Import from legacy BWTF database,California,16,South Bay,1/9/2012,12:30:00 PM,2012-01-09T19:30:00Z,Matt Waterworth,94,Ballona Marsh- Jefferson Inlet,33.971001,-118.431,,,,,,,,,=,328,,,,, ,,,,,,,,,,2020-03-09T18:36:44.000Z
553071622,Import from legacy BWTF database,California,16,South Bay,12/19/2011,1:30:00 PM,2011-12-19T20:30:00Z,Matt Waterworth,94,Ballona Marsh- Jefferson Inlet,33.971001,-118.431,,,,,,,,,<,10,,,,, ,,,,,,,,,,2020-03-09T18:36:44.000Z
553071547,Import from legacy BWTF database,California,16,South Bay,12/5/2011,12:30:00 PM,2011-12-05T19:30:00Z,Matt Waterworth,94,Ballona Marsh- Jefferson Inlet,33.971001,-118.431,,,,,,,,,=,130,,,,, ,,,,,,,,,,2020-03-09T18:36:43.000Z
553071287,Import from legacy BWTF database,California,16,South Bay,11/14/2011,12:30:00 PM,2011-11-14T19:30:00Z,Matt Waterworth,94,Ballona Marsh- Jefferson Inlet,33.971001,-118.431,,,,,,,,,=,985,,,,, ,,,,,,,,,,2020-03-09T18:36:41.000Z
553071213,Import from legacy BWTF database,California,16,South Bay,10/31/2011,12:30:00 PM,2011-10-31T19:30:00Z,Matt Waterworth,94,Ballona Marsh- Jefferson Inlet,33.971001,-118.431,,,,,,,,,=,3448,,,,, ,,,,,,,,,,2020-03-09T18:36:41.000Z
553071171,Import from legacy BWTF database,California,16,South Bay,10/17/2011,12:30:00 PM,2011-10-17T19:30:00Z,Matt Waterworth,94,Ballona Marsh- Jefferson Inlet,33.971001,-118.431,,,,,,,,,=,314,,,,, ,,,,,,,,,,2020-03-09T18:36:41.000Z
553070142,Import from legacy BWTF database,California,16,South Bay,4/16/2011,10:30:00 AM,2011-04-16T17:30:00Z,students,94,Ballona Marsh- Jefferson Inlet,33.971001,-118.431,,,,,,,,,=,41,,,,, ,,,,,,,,,,2020-03-09T18:36:32.000Z
453070026,Import from legacy BWTF database,California,16,South Bay,12/5/2010,11:30:00 AM,2010-12-05T18:30:00Z,HS Students,94,Ballona Marsh- Jefferson Inlet,33.971001,-118.431,,,,FALSE,,,,,=,860,,,,, ,,,,,,,,,,2020-03-09T18:36:29.000Z
453069638,Import from legacy BWTF database,California,16,South Bay,10/31/2010,10:30:00 AM,2010-10-31T17:30:00Z,Students,94,Ballona Marsh- Jefferson Inlet,33.971001,-118.431,,,,,,,,,=,8164,,,,, ,,,,,,,,,,2020-03-09T18:36:23.000Z
453069633,Import from legacy BWTF database,California,16,South Bay,10/18/2010,10:30:00 AM,2010-10-18T17:30:00Z,Students,94,Ballona Marsh- Jefferson Inlet,33.971001,-118.431,,,,,,,,,=,4374,,,,, ,,,,,,,,,,2020-03-09T18:36:23.000Z
453069620,Import from legacy BWTF database,California,16,South Bay,10/3/2010,10:30:00 AM,2010-10-03T17:30:00Z,Students,94,Ballona Marsh- Jefferson Inlet,33.971001,-118.431,,,,,,,,,=,712,,,,, ,,,,,,,,,,2020-03-09T18:36:23.000Z
453068740,Import from legacy BWTF database,California,16,South Bay,4/26/2010,10:30:00 AM,2010-04-26T17:30:00Z,students,94,Ballona Marsh- Jefferson Inlet,33.971001,-118.431,,,,,,,,,=,121,,,,, ,,,,,,,,,,2020-03-09T18:36:20.000Z
453068654,Import from legacy BWTF database,California,16,South Bay,4/12/2010,10:30:00 AM,2010-04-12T17:30:00Z,students,94,Ballona Marsh- Jefferson Inlet,33.971001,-118.431,,,,,,,,,=,240,,,,, ,,,,,,,,,,2020-03-09T18:36:19.000Z
453068644,Import from legacy BWTF database,California,16,South Bay,3/21/2010,10:30:00 AM,2010-03-21T17:30:00Z,students,94,Ballona Marsh- Jefferson Inlet,33.971001,-118.431,,,,,,,,,=,20,,,,, ,,,,,,,,,,2020-03-09T18:36:19.000Z
453068467,Import from legacy BWTF database,California,16,South Bay,3/7/2010,11:30:00 AM,2010-03-07T18:30:00Z,students,94,Ballona Marsh- Jefferson Inlet,33.971001,-118.431,,,,,,,,,=,2909,,,,, ,,,,,,,,,,2020-03-09T18:28:53.000Z
453068366,Import from legacy BWTF database,California,16,South Bay,2/21/2010,11:30:00 AM,2010-02-21T18:30:00Z,students,94,Ballona Marsh- Jefferson Inlet,33.971001,-118.431,,,,,,,,,=,368,,,,, ,,,,,,,,,,2020-03-09T18:28:51.000Z
453068320,Import from legacy BWTF database,California,16,South Bay,2/7/2010,11:30:00 AM,2010-02-07T18:30:00Z,students,94,Ballona Marsh- Jefferson Inlet,33.971001,-118.431,,,,,,,,,=,2481,,,,, ,,,,,,,,,,2020-03-09T18:28:50.000Z
453068288,Import from legacy BWTF database,California,16,South Bay,1/24/2010,11:30:00 AM,2010-01-24T18:30:00Z,students,94,Ballona Marsh- Jefferson Inlet,33.971001,-118.431,,,,,,,,,=,2187,,,,, ,,,,,,,,,,2020-03-09T18:28:50.000Z
453068185,Import from legacy BWTF database,California,16,South Bay,1/10/2010,11:30:00 AM,2010-01-10T18:30:00Z,students,94,Ballona Marsh- Jefferson Inlet,33.971001,-118.431,,,,,,,,,=,109,,,,, ,,,,,,,,,,2020-03-09T18:28:48.000Z
453068122,Import from legacy BWTF database,California,16,South Bay,12/6/2009,12:30:00 PM,2009-12-06T19:30:00Z,students,94,Ballona Marsh- Jefferson Inlet,33.971001,-118.431,,,,,,,,,=,145,,,,, ,,,,,,,,,,2020-03-09T18:28:48.000Z
453068051,Import from legacy BWTF database,California,16,South Bay,11/15/2009,11:30:00 AM,2009-11-15T18:30:00Z,HS students ,94,Ballona Marsh- Jefferson Inlet,33.971001,-118.431,,,,,,,,,=,1071,,,,, ,,,,,,,,,,2020-03-09T18:28:37.000Z
453068038,Import from legacy BWTF database,California,16,South Bay,11/1/2009,11:30:00 AM,2009-11-01T18:30:00Z,HS students,94,Ballona Marsh- Jefferson Inlet,33.971001,-118.431,,,,,,,,,=,2613,,,,, ,,,,,,,,,,2020-03-09T18:28:37.000Z
453068030,Import from legacy BWTF database,California,16,South Bay,10/18/2009,10:30:00 AM,2009-10-18T17:30:00Z,Students,94,Ballona Marsh- Jefferson Inlet,33.971001,-118.431,,,,,,,,,=,578,,,,, ,,,,,,,,,,2020-03-09T18:28:37.000Z
453067966,Import from legacy BWTF database,California,16,South Bay,10/4/2009,10:30:00 AM,2009-10-04T17:30:00Z,students,94,Ballona Marsh- Jefferson Inlet,33.971001,-118.431,,,,FALSE,,,,,=,173,,,,, ,,,,,,,,,,2020-03-09T18:28:36.000Z
453066851,Import from legacy BWTF database,California,16,South Bay,3/8/2009,12:30:00 PM,2009-03-08T19:30:00Z,HS students,94,Ballona Marsh- Jefferson Inlet,33.971001,-118.431,,,Partly_Cloudy,,,,,,=,10,,,,, ,,,,,,,,,,2020-03-09T18:26:52.000Z
453066858,Import from legacy BWTF database,California,16,South Bay,2/22/2009,12:30:00 PM,2009-02-22T19:30:00Z,HS students,94,Ballona Marsh- Jefferson Inlet,33.971001,-118.431,,,Partly_Cloudy,,,,,,=,301,,,,, ,,,,,,,,,,2020-03-09T18:26:52.000Z
453066713,Import from legacy BWTF database,California,16,South Bay,2/8/2009,1:30:00 PM,2009-02-08T20:30:00Z,HS students,94,Ballona Marsh- Jefferson Inlet,33.971001,-118.431,,,,,,,,,=,1860,,,,, ,,,,,,,,,,2020-03-09T18:26:41.000Z
453066623,Import from legacy BWTF database,California,16,South Bay,1/25/2009,11:30:00 AM,2009-01-25T18:30:00Z,Students after Rain,94,Ballona Marsh- Jefferson Inlet,33.971001,-118.431,,,,,,,,,=,1552,,,,, ,,,,,,,,,,2020-03-09T18:26:34.000Z
453066606,Import from legacy BWTF database,California,16,South Bay,1/11/2009,11:30:00 AM,2009-01-11T18:30:00Z,students,94,Ballona Marsh- Jefferson Inlet,33.971001,-118.431,,,,,,,,,=,40,,,,, ,,,,,,,,,,2020-03-09T18:26:34.000Z
453066226,Import from legacy BWTF database,California,16,South Bay,12/7/2008,12:30:00 PM,2008-12-07T19:30:00Z,students,94,Ballona Marsh- Jefferson Inlet,33.971001,-118.431,,,,,,,,,=,1825,,,,, ,,,,,,,,,,2020-03-09T18:26:25.000Z
453066046,Import from legacy BWTF database,California,16,South Bay,11/26/2008,10:30:00 AM,2008-11-26T17:30:00Z,Joe & Alan after Rain,94,Ballona Marsh- Jefferson Inlet,33.971001,-118.431,,,,TRUE,,,,,=,3680,,,,, ,,,,,,,,,,2020-03-09T18:26:19.000Z
453066007,Import from legacy BWTF database,California,16,South Bay,11/23/2008,11:30:00 AM,2008-11-23T18:30:00Z,students,94,Ballona Marsh- Jefferson Inlet,33.971001,-118.431,,,,,,,,,=,17879,,,,, ,,,,,,,,,,2020-03-09T18:26:19.000Z
453065827,Import from legacy BWTF database,California,16,South Bay,11/9/2008,11:30:00 AM,2008-11-09T18:30:00Z,students,94,Ballona Marsh- Jefferson Inlet,33.971001,-118.431,,,,,,,,,=,5172,,,,, ,,,,,,,,,,2020-03-09T18:26:10.000Z
453065802,Import from legacy BWTF database,California,16,South Bay,10/26/2008,10:30:00 AM,2008-10-26T17:30:00Z,students,94,Ballona Marsh- Jefferson Inlet,33.971001,-118.431,,,,,,,,,=,471,,,,, ,,,,,,,,,,2020-03-09T18:26:10.000Z
453066023,Import from legacy BWTF database,California,16,South Bay,10/23/2008,10:30:00 AM,2008-10-23T17:30:00Z, students,94,Ballona Marsh- Jefferson Inlet,33.971001,-118.431,,,,,,,,,=,17879,,,,, ,,,,,,,,,,2020-03-09T18:26:19.000Z
453065617,Import from legacy BWTF database,California,16,South Bay,10/12/2008,12:30:00 PM,2008-10-12T19:30:00Z,students,94,Ballona Marsh- Jefferson Inlet,33.971001,-118.431,,,,,,,,,=,959,,,,, ,,,,,,,,,,2020-03-09T18:26:10.000Z
453066358,Import from legacy BWTF database,California,16,South Bay,4/6/2008,10:30:00 AM,2008-04-06T17:30:00Z,students,94,Ballona Marsh- Jefferson Inlet,33.971001,-118.431,,,,,,,,,=,20,,,,, ,,,,,,,,,,2020-03-09T18:26:32.000Z
453066370,Import from legacy BWTF database,California,16,South Bay,3/15/2008,10:30:00 AM,2008-03-15T17:30:00Z,students,94,Ballona Marsh- Jefferson Inlet,33.971001,-118.431,,,,,,,,,=,307,,,,, ,,,,,,,,,,2020-03-09T18:26:32.000Z
453066373,Import from legacy BWTF database,California,16,South Bay,2/24/2008,11:30:00 AM,2008-02-24T18:30:00Z,students,94,Ballona Marsh- Jefferson Inlet,33.971001,-118.431,,,,,,,,,=,436,,,,, ,,,,,,,,,,2020-03-09T18:26:32.000Z
453066383,Import from legacy BWTF database,California,16,South Bay,1/27/2008,11:30:00 AM,2008-01-27T18:30:00Z,students,94,Ballona Marsh- Jefferson Inlet,33.971001,-118.431,,,,,,,,,=,20,,,,, ,,,,,,,,,,2020-03-09T18:26:33.000Z
453066387,Import from legacy BWTF database,California,16,South Bay,1/20/2008,11:30:00 AM,2008-01-20T18:30:00Z,students,94,Ballona Marsh- Jefferson Inlet,33.971001,-118.431,,,,,,,,,=,230,,,,, ,,,,,,,,,,2020-03-09T18:26:33.000Z
453066393,Import from legacy BWTF database,California,16,South Bay,12/16/2007,10:30:00 AM,2007-12-16T17:30:00Z,students,94,Ballona Marsh- Jefferson Inlet,33.971001,-118.431,,,,,,,,,=,251,,,,, ,,,,,,,,,,2020-03-09T18:26:33.000Z
453066309,Import from legacy BWTF database,California,16,South Bay,12/2/2007,12:30:00 PM,2007-12-02T19:30:00Z,students Rain,94,Ballona Marsh- Jefferson Inlet,33.971001,-118.431,,,,TRUE,,,,,=,339,,,,, ,,,,,,,,,,2020-03-09T18:26:32.000Z
453066289,Import from legacy BWTF database,California,16,South Bay,11/18/2007,12:30:00 PM,2007-11-18T19:30:00Z,students,94,Ballona Marsh- Jefferson Inlet,33.971001,-118.431,,,,,,,,,=,298,,,,, ,,,,,,,,,,2020-03-09T18:26:32.000Z
453066286,Import from legacy BWTF database,California,16,South Bay,11/4/2007,12:30:00 PM,2007-11-04T19:30:00Z,students,94,Ballona Marsh- Jefferson Inlet,33.971001,-118.431,,,,,,,,,=,313,,,,, ,,,,,,,,,,2020-03-09T18:26:32.000Z
453066265,Import from legacy BWTF database,California,16,South Bay,10/21/2007,12:30:00 PM,2007-10-21T19:30:00Z,students,94,Ballona Marsh- Jefferson Inlet,33.971001,-118.431,,,,,,,,,=,677,,,,, ,,,,,,,,,,2020-03-09T18:26:32.000Z
453066262,Import from legacy BWTF database,California,16,South Bay,10/7/2007,12:30:00 PM,2007-10-07T19:30:00Z,students,94,Ballona Marsh- Jefferson Inlet,33.971001,-118.431,,,,,,,,,=,161,,,,, ,,,,,,,,,,2020-03-09T18:26:25.000Z
453066096,Import from legacy BWTF database,California,16,South Bay,3/11/2007,10:30:00 AM,2007-03-11T17:30:00Z,students ,94,Ballona Marsh- Jefferson Inlet,33.971001,-118.431,,,,FALSE,,,,,=,158,,,,, ,,,,,,,,,,2020-03-09T18:26:19.000Z
453066095,Import from legacy BWTF database,California,16,South Bay,2/25/2007,11:30:00 AM,2007-02-25T18:30:00Z,students ,94,Ballona Marsh- Jefferson Inlet,33.971001,-118.431,,,,FALSE,,,,,=,211,,,,, ,,,,,,,,,,2020-03-09T18:26:19.000Z
453066094,Import from legacy BWTF database,California,16,South Bay,2/4/2007,11:30:00 AM,2007-02-04T18:30:00Z,students ,94,Ballona Marsh- Jefferson Inlet,33.971001,-118.431,,,,FALSE,,,,,=,275,,,,, ,,,,,,,,,,2020-03-09T18:26:19.000Z
453066093,Import from legacy BWTF database,California,16,South Bay,1/21/2007,11:30:00 AM,2007-01-21T18:30:00Z,students ,94,Ballona Marsh- Jefferson Inlet,33.971001,-118.431,,,,FALSE,,,,,=,279,,,,, ,,,,,,,,,,2020-03-09T18:26:19.000Z
453066092,Import from legacy BWTF database,California,16,South Bay,1/7/2007,11:30:00 AM,2007-01-07T18:30:00Z,students ,94,Ballona Marsh- Jefferson Inlet,33.971001,-118.431,,,,FALSE,,,,,=,1187,,,,, ,,,,,,,,,,2020-03-09T18:26:19.000Z
453066091,Import from legacy BWTF database,California,16,South Bay,12/17/2006,11:30:00 AM,2006-12-17T18:30:00Z,students after Rain ,94,Ballona Marsh- Jefferson Inlet,33.971001,-118.431,,,,TRUE,,,,,=,2909,,,,, ,,,,,,,,,,2020-03-09T18:26:19.000Z
453066090,Import from legacy BWTF database,California,16,South Bay,12/3/2006,11:30:00 AM,2006-12-03T18:30:00Z,students,94,Ballona Marsh- Jefferson Inlet,33.971001,-118.431,,,,TRUE,,,,,=,301,,,,, ,,,,,,,,,,2020-03-09T18:26:19.000Z
453066089,Import from legacy BWTF database,California,16,South Bay,11/28/2006,11:30:00 AM,2006-11-28T18:30:00Z,Joe & Alan after Rain ,94,Ballona Marsh- Jefferson Inlet,33.971001,-118.431,,,,TRUE,,,,,=,14136,,,,, ,,,,,,,,,,2020-03-09T18:26:19.000Z
453066088,Import from legacy BWTF database,California,16,South Bay,11/19/2006,11:30:00 AM,2006-11-19T18:30:00Z,students ,94,Ballona Marsh- Jefferson Inlet,33.971001,-118.431,,,,FALSE,,,,,=,426,,,,, ,,,,,,,,,,2020-03-09T18:26:19.000Z
453066087,Import from legacy BWTF database,California,16,South Bay,11/5/2006,11:30:00 AM,2006-11-05T18:30:00Z,students ,94,Ballona Marsh- Jefferson Inlet,33.971001,-118.431,,,,FALSE,,,,,=,552,,,,, ,,,,,,,,,,2020-03-09T18:26:19.000Z
453066086,Import from legacy BWTF database,California,16,South Bay,10/15/2006,10:30:00 AM,2006-10-15T17:30:00Z,students ,94,Ballona Marsh- Jefferson Inlet,33.971001,-118.431,,,,FALSE,,,,,=,228,,,,, ,,,,,,,,,,2020-03-09T18:26:19.000Z
453066085,Import from legacy BWTF database,California,16,South Bay,10/1/2006,10:30:00 AM,2006-10-01T17:30:00Z,students ,94,Ballona Marsh- Jefferson Inlet,33.971001,-118.431,,,,FALSE,,,,,=,52,,,,, ,,,,,,,,,,2020-03-09T18:26:19.000Z
453060582,Import from legacy BWTF database,California,16,South Bay,4/10/2006,12:30:00 PM,2006-04-10T19:30:00Z,students,94,Ballona Marsh- Jefferson Inlet,33.971001,-118.431,,,,,,,,,<,10,<,10,=,10810, ,,,,,,,,,,2020-03-09T18:22:39.000Z
453060303,Import from legacy BWTF database,California,16,South Bay,3/26/2006,12:30:00 PM,2006-03-26T19:30:00Z,students,94,Ballona Marsh- Jefferson Inlet,33.971001,-118.431,,,,,,,,,=,51,=,52,=,2851, ,,,,,,,,,,2020-03-09T18:22:38.000Z
453060213,Import from legacy BWTF database,California,16,South Bay,3/12/2006,11:30:00 AM,2006-03-12T18:30:00Z,students,94,Ballona Marsh- Jefferson Inlet,33.971001,-118.431,,,,,,,,,<,10,=,630,=,24196, ,,,,,,,,,,2020-03-09T18:22:38.000Z
453060204,Import from legacy BWTF database,California,16,South Bay,2/28/2006,11:30:00 AM,2006-02-28T18:30:00Z,students,94,Ballona Marsh- Jefferson Inlet,33.971001,-118.431,,,,,,,,,=,355,=,712,=,24196, ,,,,,,,,,,2020-03-09T18:22:38.000Z
453060193,Import from legacy BWTF database,California,16,South Bay,2/26/2006,11:30:00 AM,2006-02-26T18:30:00Z,students,94,Ballona Marsh- Jefferson Inlet,33.971001,-118.431,,,,,,,,,=,309,=,146,=,24196, ,,,,,,,,,,2020-03-09T18:22:30.000Z
453060045,Import from legacy BWTF database,California,16,South Bay,1/23/2006,12:30:00 PM,2006-01-23T19:30:00Z,student,94,Ballona Marsh- Jefferson Inlet,33.971001,-118.431,,,,,,,,,<,10,=,105,=,19863, ,,,,,,,,,,2020-03-09T18:22:30.000Z
453060034,Import from legacy BWTF database,California,16,South Bay,1/9/2006,12:30:00 PM,2006-01-09T19:30:00Z,student,94,Ballona Marsh- Jefferson Inlet,33.971001,-118.431,,,,,,,,,=,156,=,350,=,15531, ,,,,,,,,,,2020-03-09T18:22:30.000Z
453060022,Import from legacy BWTF database,California,16,South Bay,12/19/2005,12:30:00 PM,2005-12-19T19:30:00Z,student,94,Ballona Marsh- Jefferson Inlet,33.971001,-118.431,,,,,,,,,=,95,=,907,=,2613, ,,,,,,,,,,2020-03-09T18:22:30.000Z
453060010,Import from legacy BWTF database,California,16,South Bay,12/4/2005,12:30:00 PM,2005-12-04T19:30:00Z,student,94,Ballona Marsh- Jefferson Inlet,33.971001,-118.431,,,,,,,,,=,1334,=,5172,=,24196, ,,,,,,,,,,2020-03-09T18:22:30.000Z
453059997,Import from legacy BWTF database,California,16,South Bay,11/20/2005,12:30:00 PM,2005-11-20T19:30:00Z,student,94,Ballona Marsh- Jefferson Inlet,33.971001,-118.431,,,,,,,,,=,260,=,1860,=,24196, ,,,,,,,,,,2020-03-09T18:22:29.000Z
453059986,Import from legacy BWTF database,California,16,South Bay,11/6/2005,12:30:00 PM,2005-11-06T19:30:00Z,student,94,Ballona Marsh- Jefferson Inlet,33.971001,-118.431,,,,,,,,,=,119,=,2187,=,17329, ,,,,,,,,,,2020-03-09T18:22:29.000Z
453059976,Import from legacy BWTF database,California,16,South Bay,10/24/2005,12:30:00 PM,2005-10-24T19:30:00Z,student,94,Ballona Marsh- Jefferson Inlet,33.971001,-118.431,,,,,,,,,=,425,=,882,=,24196, ,,,,,,,,,,2020-03-09T18:22:29.000Z
453059963,Import from legacy BWTF database,California,16,South Bay,10/9/2005,12:30:00 PM,2005-10-09T19:30:00Z,student,94,Ballona Marsh- Jefferson Inlet,33.971001,-118.431,,,,,,,,,=,52,=,98,=,7215, ,,,,,,,,,,2020-03-09T18:22:29.000Z