sample id,data entry author,state,lab id,lab name,collection date,collection time (America/Los_Angeles),stored collectionTime,tested by,site id,site name,latitude,longitude,water temperature (f),air temperature (f),current weather,recent precipitation,tide,wave height,wind speed (mph),wind direction,Enterococcus modifier,Enterococcus (mpn/100mL),Ecoli modifier,Ecoli (mpn/100mL),Total Coliform modifier,Total Coliform (mpn/100mL),comments,pH,Salinity (PSU),Turbidity (NTU),Ammonia/NH3 (ppm),Nitrates/NO3 (mg/L),Nitrites/NO2 (mg/L),Nitrogen(NO3+NO2) (mg/L),Phosphate (mg/L),Dissolved Oxygen (mg/L),publication time
ea69492f-38fe-45bc-a091-f1ec7703f120,Google_114632842198855839133,California,16,South Bay,5/11/2025,10:00:00 AM,2025-05-11T17:00:00.000Z,CC,93,Ballona Freshwater Marsh Outlet,33.970001,-118.433998,,72,Sunny,FALSE,,,6,SW,=,235,,,,,,,,,,,,,,,2025-05-13T00:38:08.658Z
f822a5ec-0700-4771-b268-eb26bb45e46e,Google_114632842198855839133,California,16,South Bay,4/27/2025,10:30:00 AM,2025-04-27T17:30:00.000Z,CC,93,Ballona Freshwater Marsh Outlet,33.970001,-118.433998,,63,Partly_Cloudy,FALSE,,,,,>,24196,,,,,,,,,,,,,,,2025-04-29T00:48:07.804Z
e3892556-2762-4669-8161-dfabfbe25037,Google_114632842198855839133,California,16,South Bay,4/13/2025,10:00:00 AM,2025-04-13T17:00:00.000Z,CC,93,Ballona Freshwater Marsh Outlet,33.970001,-118.433998,,59,Overcast,FALSE,,,,,=,959,,,,,WATER LOOKED CLEANER THAT USUAL,,,,,,,,,,2025-04-14T23:27:13.561Z
2c111671-09c1-41f7-829c-f46240987277,Google_114632842198855839133,California,16,South Bay,3/30/2025,10:00:00 AM,2025-03-30T17:00:00.000Z,CC,93,Ballona Freshwater Marsh Outlet,33.970001,-118.433998,,58,Light_Rain,FALSE,,,,,=,481,,,,,,,,,,,,,,,2025-04-01T00:41:42.531Z
5220f2d4-9e1f-42ec-829d-1110a0b9996f,Google_114632842198855839133,California,16,South Bay,3/16/2025,10:30:00 AM,2025-03-16T17:30:00.000Z,CC,93,Ballona Freshwater Marsh Outlet,33.970001,-118.433998,,65,Partly_Cloudy,TRUE,,,,,=,932,,,,,,,,,,,,,,,2025-03-17T21:37:19.736Z
05a5bd28-a771-4fca-9178-fc2bc182090b,Google_114632842198855839133,California,16,South Bay,1/19/2025,11:00:00 AM,2025-01-19T18:00:00.000Z,CC,93,Ballona Freshwater Marsh Outlet,33.970001,-118.433998,,55,Partly_Cloudy,FALSE,,,,,=,776,,,,,,,,,,,,,,,2025-01-21T00:27:44.216Z
c8c93eb2-c436-49db-aa04-a043e3823af4,Google_114632842198855839133,California,16,South Bay,1/5/2025,11:00:00 AM,2025-01-05T18:00:00.000Z,CC,93,Ballona Freshwater Marsh Outlet,33.970001,-118.433998,,68,Sunny,FALSE,,,,,=,4884,,,,,,,,,,,,,,,2025-01-06T23:31:35.962Z
6d3743d5-b053-48c2-a471-d0d580f55a87,Google_114632842198855839133,California,16,South Bay,12/15/2024,11:00:00 AM,2024-12-15T18:00:00.000Z,CC,93,Ballona Freshwater Marsh Outlet,33.970001,-118.433998,,66,Sunny,FALSE,,,,,=,4106,,,,,,,,,,,,,,,2024-12-17T00:51:02.385Z
b942c225-dc5e-4b4f-a53c-6cf086d49420,Google_114632842198855839133,California,16,South Bay,12/1/2024,12:00:00 PM,2024-12-01T19:00:00.000Z,CC,93,Ballona Freshwater Marsh Outlet,33.970001,-118.433998,61,65,Sunny,FALSE,,,,,=,24196,,,,,,,,,,,,,,,2024-12-02T22:40:22.629Z
28e24fd6-24cf-461f-b9bd-9d58200aed14,Google_114632842198855839133,California,16,South Bay,11/17/2024,11:00:00 AM,2024-11-17T18:00:00.000Z,CC,93,Ballona Freshwater Marsh Outlet,33.970001,-118.433998,,65,Sunny,FALSE,,,,,=,1203,,,,,,,,,,,,,,,2024-11-18T23:40:26.279Z
3b3b9a9e-651a-46f5-ab87-67ed376472ca,Google_114632842198855839133,California,16,South Bay,11/3/2024,11:00:00 AM,2024-11-03T18:00:00.000Z,CC,93,Ballona Freshwater Marsh Outlet,33.970001,-118.433998,,71,Sunny,FALSE,,,6,NW,=,1274,,,,,ADDITIONAL CONTROLS: Staph MPN <10; E. coli MPN <10; Enterococcus fecalis MPN 1918,,,,,,,,,,2024-11-04T23:53:39.006Z
003bbb38-3a6f-412f-959a-4dc123dfc174,Google_114632842198855839133,California,16,South Bay,10/20/2024,10:00:00 AM,2024-10-20T17:00:00.000Z,CC,93,Ballona Freshwater Marsh Outlet,33.970001,-118.433998,,74,Sunny,FALSE,,,,,=,1785,,,,,,,,,,,,,,,2024-10-21T22:15:34.195Z
1eadd1ea-40f5-45e5-91f3-48215bfb50e7,Google_114632842198855839133,California,16,South Bay,10/6/2024,10:00:00 AM,2024-10-06T17:00:00.000Z,CC,93,Ballona Freshwater Marsh Outlet,33.970001,-118.433998,,63,Fog,FALSE,,,,,=,2046,,,,,,,,,,,,,,,2024-10-08T00:34:39.362Z
52ef5e0c-dcc2-4db1-b070-8eea1a8a9c1d,Google_114632842198855839133,California,16,South Bay,9/22/2024,10:00:00 AM,2024-09-22T17:00:00.000Z,CC,93,Ballona Freshwater Marsh Outlet,33.970001,-118.433998,,71,Partly_Cloudy,FALSE,,,,,=,10462,,,,,,,,,,,,,,,2024-09-24T00:15:37.566Z
e82356f5-86d1-48df-867b-32237ca9dc0d,Google_114632842198855839133,California,16,South Bay,5/5/2024,10:00:00 AM,2024-05-05T17:00:00.000Z,CC,93,Ballona Freshwater Marsh Outlet,33.970001,-118.433998,,61,Partly_Cloudy,FALSE,,,7,W,=,132,,,,,,,,,,,,,,,2024-05-07T00:56:33.519Z
4145752b-1485-4410-a296-ee412c98376c,Google_114632842198855839133,California,16,South Bay,4/21/2024,10:00:00 AM,2024-04-21T17:00:00.000Z,CC,93,Ballona Freshwater Marsh Outlet,33.970001,-118.433998,,62,Overcast,FALSE,,,5,SW,=,158,,,,,,,,,,,,,,,2024-04-22T22:58:08.236Z
8097f8de-12bc-4d2f-a57d-6af5260776ad,Google_114632842198855839133,California,16,South Bay,4/7/2024,10:00:00 AM,2024-04-07T17:00:00.000Z,CC,93,Ballona Freshwater Marsh Outlet,33.970001,-118.433998,,58,Sunny,TRUE,,,5,SW,=,107,,,,,,,,,,,,,,,2024-04-08T22:38:16.596Z
101623a5-8ec4-4033-9433-617e16435302,Google_114632842198855839133,California,16,South Bay,3/17/2024,10:00:00 AM,2024-03-17T17:00:00.000Z,CC,93,Ballona Freshwater Marsh Outlet,33.970001,-118.433998,,60,Partly_Cloudy,FALSE,,,,,=,2909,,,,,,,,,,,,,,,2024-03-18T22:59:57.468Z
f7d1440a-86e8-40b0-a914-a0223bb490a0,Google_114632842198855839133,California,16,South Bay,3/3/2024,11:00:00 AM,2024-03-03T18:00:00.000Z,CC,93,Ballona Freshwater Marsh Outlet,33.970001,-118.433998,,55,Partly_Cloudy,TRUE,,,6,SW,=,120,,,,,,,,,,,,,,,2024-03-04T23:08:37.474Z
33224b19-9694-4af7-ac99-670568ae621a,Google_114632842198855839133,California,16,South Bay,2/18/2024,11:00:00 AM,2024-02-18T18:00:00.000Z,CC,93,Ballona Freshwater Marsh Outlet,33.970001,-118.433998,59,55,Partly_Cloudy,FALSE,,,,,=,63,,,,,,,,,,,,,,,2024-02-20T01:33:36.854Z
7c20d3e1-45ec-4e85-ad90-44e4dff58a25,Google_114632842198855839133,California,16,South Bay,1/21/2024,11:00:00 AM,2024-01-21T18:00:00.000Z,CC,93,Ballona Freshwater Marsh Outlet,33.970001,-118.433998,,61,Partly_Cloudy,TRUE,,,,,>,24196,,,,,critters swimming in sample; trash on surface of water,,,,,,,,,,2024-01-23T00:21:11.074Z
8019a0fe-b380-419f-b731-1e9f8ddaa4c0,Google_101636539682545301424,California,16,South Bay,1/7/2024,11:00:00 AM,2024-01-07T18:00:00.000Z,CC,93,Ballona Freshwater Marsh Outlet,33.970001,-118.433998,,55,Sunny,FALSE,,,8,NW,=,199,,,,,,,,,,,,,,,2024-01-09T02:07:43.583Z
79b7d809-5fb4-4911-affe-458d29225852,Google_101636539682545301424,California,16,South Bay,12/17/2023,11:00:00 AM,2023-12-17T18:00:00.000Z,CC,93,Ballona Freshwater Marsh Outlet,33.970001,-118.433998,,73,Partly_Cloudy,FALSE,,,,,=,216,,,,,,,,,,,,,,,2023-12-19T02:22:24.957Z
7c38ead9-b86c-4dab-938d-db4378a6e8d6,Google_101636539682545301424,California,16,South Bay,12/3/2023,10:30:00 AM,2023-12-03T17:30:00.000Z,CC,93,Ballona Freshwater Marsh Outlet,33.970001,-118.433998,,65,Sunny,FALSE,,,,,=,97,,,,,,,,,,,,,,,2023-12-05T01:09:03.777Z
8fc8ae78-9cf1-47b6-92fa-c59c4b06bdbb,Google_101636539682545301424,California,16,South Bay,11/19/2023,10:30:00 AM,2023-11-19T17:30:00.000Z,CC,93,Ballona Freshwater Marsh Outlet,33.970001,-118.433998,,68,Sunny,TRUE,,,,,=,19863,,,,,,,,,,,,,,,2023-11-20T23:50:21.983Z
8c4c1c79-f43e-4d5f-9655-94188557b43d,Google_101636539682545301424,California,16,South Bay,11/5/2023,11:00:00 AM,2023-11-05T18:00:00.000Z,CC,93,Ballona Freshwater Marsh Outlet,33.970001,-118.433998,,68,Sunny,FALSE,,,,,=,120,,,,,,,,,,,,,,,2023-11-06T23:07:19.657Z
f9580e2e-9cf1-4c40-914e-68a43b95cacd,Google_101636539682545301424,California,16,South Bay,10/22/2023,10:00:00 AM,2023-10-22T17:00:00.000Z,CC,93,Ballona Freshwater Marsh Outlet,33.970001,-118.433998,,70,Sunny,FALSE,,,,,=,110,,,,,,,,,,,,,,,2023-10-23T23:50:35.112Z
06511ff2-9070-496c-aaf1-78d96d7ec3c9,Google_101636539682545301424,California,16,South Bay,10/8/2023,10:00:00 AM,2023-10-08T17:00:00.000Z,CC,93,Ballona Freshwater Marsh Outlet,33.970001,-118.433998,,66,Overcast,FALSE,,,,,=,84,,,,,"LAB DUP RUN WITH TWO FOOD PACKETS; 7L, 1S
ORIGINAL SAMPLE 6L, 2S",,,,,,,,,,2023-10-09T23:09:53.537Z
190ef34c-b8c2-46cc-a539-f29ab1de7b82,Google_117493629236158511870,California,16,South Bay,5/14/2023,10:30:00 AM,2023-05-14T17:30:00.000Z,CC,93,Ballona Freshwater Marsh Outlet,33.970001,-118.433998,,66,Overcast,FALSE,,,,,=,20,,,,,Oily substance at 1B on surface,,,,,,,,,,2023-05-16T00:39:13.726Z
568176db-5aab-4a3f-842f-14ce902d9a4a,Google_101636539682545301424,California,16,South Bay,4/30/2023,10:50:00 AM,2023-04-30T17:50:00.000Z,CC,93,Ballona Freshwater Marsh Outlet,33.970001,-118.433998,,57,Overcast,FALSE,,,,,=,97,,,,,,,,,,,,,,,2023-05-01T22:53:53.258Z
4f9f8b2f-834e-4224-bea2-e00574382923,Google_101636539682545301424,California,16,South Bay,4/16/2023,10:30:00 AM,2023-04-16T17:30:00.000Z,CC,93,Ballona Freshwater Marsh Outlet,33.970001,-118.433998,,57,Overcast,FALSE,,,4,W,=,109,,,,,,,,,,,,,,,2023-04-17T23:15:08.662Z
f607512a-7c0c-43a7-8a2d-2e75a87fc0d2,Google_101636539682545301424,California,16,South Bay,4/2/2023,11:00:00 AM,2023-04-02T18:00:00.000Z,CC,93,Ballona Freshwater Marsh Outlet,33.970001,-118.433998,,62,Partly_Cloudy,FALSE,,,3,W,=,763,,,,,very wet and muddy,,,,,,,,,,2023-04-03T23:13:41.850Z
be6786c1-dbc9-4bb6-bc6d-403beadb863c,Google_101636539682545301424,California,16,South Bay,3/19/2023,10:30:00 AM,2023-03-19T17:30:00.000Z,CC,93,Ballona Freshwater Marsh Outlet,33.970001,-118.433998,,60,Light_Rain,TRUE,,,3,SW,=,63,,,,,"very muddy
",,,,,,,,,,2023-03-20T21:53:24.047Z
689479ec-ff43-43be-ad97-1d1d871b1f63,Google_101636539682545301424,California,16,South Bay,3/5/2023,11:00:00 AM,2023-03-05T18:00:00.000Z,CC,93,Ballona Freshwater Marsh Outlet,33.970001,-118.433998,,52,Light_Rain,TRUE,,,,,=,51,,,,,,,,,,,,,,,2023-03-06T22:52:26.670Z
6fc0702b-88ec-42dd-8202-3b5d61f0d933,Google_101636539682545301424,California,16,South Bay,2/19/2023,11:00:00 AM,2023-02-19T18:00:00.000Z,CC,93,Ballona Freshwater Marsh Outlet,33.970001,-118.433998,,61,Sunny,FALSE,,,,,=,31,,,,,"Lab Dup, QC 31, 10 MPN",,,,,,,,,,2023-02-20T22:22:17.113Z
94db8e83-9893-466f-bc4b-085458c3e59e,Google_101636539682545301424,California,16,South Bay,2/5/2023,11:00:00 AM,2023-02-05T18:00:00.000Z,CC,93,Ballona Freshwater Marsh Outlet,33.970001,-118.433998,,60,Partly_Cloudy,FALSE,,,10,W,=,733,,,,,,,,,,,,,,,2023-02-07T00:18:47.984Z
7c4ce816-90ee-4305-8164-5909828a7e18,Google_101636539682545301424,California,16,South Bay,1/22/2023,11:00:00 AM,2023-01-22T18:00:00.000Z,CC,93,Ballona Freshwater Marsh Outlet,33.970001,-118.433998,,57,Sunny,TRUE,,,,,=,177,,,,,low flow out of marsh,,,,,,,,,,2023-01-24T00:55:37.193Z
3e780a88-b7c0-4f5f-9226-610e3894ef30,Google_101636539682545301424,California,16,South Bay,1/8/2023,11:00:00 AM,2023-01-08T18:00:00.000Z,CC,93,Ballona Freshwater Marsh Outlet,33.970001,-118.433998,,63,Partly_Cloudy,TRUE,,,,,=,156,,,,,"Strong storm last week, King Tide 835AM 6 Jan. Visible coastal erosion, Life guard towers moved in Hermosa beach to escape surf, High surf.",,,,,,,,,,2023-01-09T23:14:25.238Z
aa288093-109b-4958-bff8-cca81df6cb96,Google_101636539682545301424,California,16,South Bay,12/18/2022,11:30:00 AM,2022-12-18T18:30:00.000Z,CC,93,Ballona Freshwater Marsh Outlet,33.970001,-118.433998,,64,Sunny,FALSE,,,,,=,61,,,,,,,,,,,,,,,2022-12-20T17:05:37.278Z
15588dd6-17bc-4406-bfec-ace25c4565c7,Google_101636539682545301424,California,16,South Bay,12/4/2022,12:00:00 PM,2022-12-04T19:00:00.000Z,CC,93,Ballona Freshwater Marsh Outlet,33.970001,-118.433998,,62,Partly_Cloudy,TRUE,,,,,=,241,,,,,,,,,,,,,,,2022-12-06T20:21:29.906Z
a3fabee1-37cb-4c23-811d-c079b92866a7,Google_101636539682545301424,California,16,South Bay,11/20/2022,12:00:00 PM,2022-11-20T19:00:00.000Z,CC,93,Ballona Freshwater Marsh Outlet,33.970001,-118.433998,,65,Sunny,FALSE,,,,,=,107,,,,,water not as visibly dirty as last few times,,,,,,,,,,2022-11-21T22:50:13.303Z
ca97bc4c-532e-44f9-9417-d88e9ed9bc5b,Google_101636539682545301424,California,16,South Bay,11/6/2022,12:00:00 PM,2022-11-06T19:00:00.000Z,CC,93,Ballona Freshwater Marsh Outlet,33.970001,-118.433998,,66,Sunny,FALSE,,,8,W,=,110,,,,,"brown and green materials (vegetation, etc.) floating in water
Marsh outlet- water flowing backwards (because of wind?)",,,,,,,,,,2022-11-08T01:45:45.690Z
6d0ad275-4b5e-49c2-aa99-222b9dc81ffd,Google_101636539682545301424,California,16,South Bay,10/23/2022,10:00:00 AM,2022-10-23T17:00:00.000Z,CC,93,Ballona Freshwater Marsh Outlet,33.970001,-118.433998,,67,Sunny,FALSE,,,,,=,52,,,,,water at1B brown,,,,,,,,,,2022-10-24T23:32:48.143Z
a7f58398-f144-4a9d-a111-322c3728bfaf,Google_101636539682545301424,California,16,South Bay,10/9/2022,11:00:00 AM,2022-10-09T18:00:00.000Z,CC,93,Ballona Freshwater Marsh Outlet,33.970001,-118.433998,,68,Overcast,FALSE,,,4,SW,=,20,,,,,NO FLOW OUT OF FRESHWATER MARSH,,,,,,,,,,2022-10-10T21:21:36.758Z
46fdbc1f-c816-48b6-a1fe-a646894e81a8,Google_101636539682545301424,California,16,South Bay,9/25/2022,11:00:00 AM,2022-09-25T18:00:00.000Z,CC,93,Ballona Freshwater Marsh Outlet,33.970001,-118.433998,,76,Sunny,FALSE,,,2,SW,=,109,,,,,algae growing everywhere,,,,,,,,,,2022-09-26T21:53:12.203Z
03881049-5806-42a4-a624-d875f10c921a,Google_101636539682545301424,California,16,South Bay,5/1/2022,10:30:00 AM,2022-05-01T17:30:00.000Z,CC,93,Ballona Freshwater Marsh Outlet,33.970001,-118.433998,,65,Sunny,FALSE,,,,,=,41,,,,,,,,,,,,,,,2022-05-02T20:48:52.503Z
f024fa8f-fa17-484e-a076-07bdd4b71b89,Google_101636539682545301424,California,16,South Bay,4/3/2022,10:30:00 AM,2022-04-03T17:30:00.000Z,CC,93,Ballona Freshwater Marsh Outlet,33.970001,-118.433998,59,57,Sunny,FALSE,,,6,SW,=,72,,,,,,,,,,,,,,,2022-04-05T00:30:18.120Z
1378eb24-45e2-42e0-910c-dee55dc37618,Google_101636539682545301424,California,16,South Bay,3/20/2022,10:30:00 AM,2022-03-20T17:30:00.000Z,CC,93,Ballona Freshwater Marsh Outlet,33.970001,-118.433998,58,59,Sunny,TRUE,,,7,W,=,465,,,,,"RAINED   0.03-0.06 "" between 10pm 19 March and 4am 20 March in the Redondo and Hermosa Beach areas. Marina Del Rey only 0.01"", Palos Verdes 0.17"", so  Southern Santa Monica Bay got more precipitation. ",,,,,,,,,,2022-03-21T21:30:50.019Z
bd54e50d-886b-42f8-b782-b9f4a7358f8f,Google_101636539682545301424,California,16,South Bay,3/6/2022,11:00:00 AM,2022-03-06T18:00:00.000Z,CC,93,Ballona Freshwater Marsh Outlet,33.970001,-118.433998,57,60,Sunny,FALSE,,,5,W,=,110,,,,,"Previous two days had winds up to 25 MPH with gusts of 30MPH; generally W, but sometimes E",,,,,,,,,,2022-03-08T00:28:53.703Z
cf13208a-48c7-4a90-978c-d8213bfd7c8f,Google_101636539682545301424,California,16,South Bay,2/20/2022,11:30:00 AM,2022-02-20T18:30:00.000Z,CC,93,Ballona Freshwater Marsh Outlet,33.970001,-118.433998,,55,Partly_Cloudy,FALSE,,,,,=,73,,,,,,,,,,,,,,,2022-02-22T01:32:23.948Z
0656b6a7-4339-40ce-8b5e-654ac0eb2cf5,Google_101636539682545301424,California,16,South Bay,2/7/2022,11:00:00 AM,2022-02-07T18:00:00.000Z,"CC, DT",93,Ballona Freshwater Marsh Outlet,33.970001,-118.433998,,70,Sunny,FALSE,,,3,W,=,84,,,,,,,,,,,,,,,2022-02-07T21:56:26.068Z
6ec53200-e55b-42cf-9d91-2e33eedd4082,Google_101636539682545301424,California,16,South Bay,1/23/2022,11:00:00 AM,2022-01-23T18:00:00.000Z,CC,93,Ballona Freshwater Marsh Outlet,33.970001,-118.433998,,71,Sunny,FALSE,,,,,=,284,,,,,,,,,,,,,,,2022-01-24T22:59:31.072Z
834b10fd-2069-4504-9179-d5d59cb30347,Google_101636539682545301424,California,16,South Bay,1/9/2022,11:00:00 AM,2022-01-09T18:00:00.000Z,CC,93,Ballona Freshwater Marsh Outlet,33.970001,-118.433998,,60,Sunny,FALSE,,,,,=,10,,,,,,,,,,,,,,,2022-01-10T23:00:23.970Z
f900cc07-9cf4-4e18-8825-083388fc6c66,Google_101636539682545301424,California,16,South Bay,12/19/2021,12:00:00 PM,2021-12-19T19:00:00.000Z,CC,93,Ballona Freshwater Marsh Outlet,33.970001,-118.433998,,65,Sunny,FALSE,,,,,=,20,,,,,"QC SAMPLES MPN 20, <10",,,,,,,,,,2021-12-20T23:21:40.922Z
32b5fa0b-0436-4447-9c99-79f643a777f0,Google_101636539682545301424,California,16,South Bay,12/5/2021,11:00:00 AM,2021-12-05T18:00:00.000Z,CC,93,Ballona Freshwater Marsh Outlet,33.970001,-118.433998,,65,Sunny,FALSE,,,,,=,627,,,,,"Trash, homeless people everywhere (sign says it will be cleaned up soon)",,,,,,,,,,2021-12-07T02:15:09.423Z
236d9a65-5d75-4cec-b84b-df9bc34b7669,Google_101636539682545301424,California,16,South Bay,11/21/2021,11:30:00 PM,2021-11-22T06:30:00.000Z,CC,93,Ballona Freshwater Marsh Outlet,33.970001,-118.433998,,75,Sunny,FALSE,,,,,=,110,,,,,"HOMELESS PEOPLE INCREASED FROM LAST TIME, TRASH",,,,,,,,,,2021-11-22T21:09:17.976Z
5fe04d3c-b9de-478b-9fed-8965f4b70760,Google_101636539682545301424,California,16,South Bay,11/7/2021,12:00:00 PM,2021-11-07T19:00:00.000Z,CC,93,Ballona Freshwater Marsh Outlet,33.970001,-118.433998,,60,Fog,FALSE,,,,,=,282,,,,,"LOTS OF RUBBISH, HOMELESS ENCAMPMENT",,,,,,,,,,2021-11-08T21:16:08.767Z
a2fa7b1e-11b9-4966-967d-2d673de7d757,Google_101636539682545301424,California,16,South Bay,10/24/2021,10:00:00 AM,2021-10-24T17:00:00.000Z,CC,93,Ballona Freshwater Marsh Outlet,33.970001,-118.433998,,67,Sunny,FALSE,,,,,=,173,,,,,,,,,,,,,,,2021-10-25T22:54:22.799Z
cd3710c2-61cc-430f-bf9d-5e27bcaa3c4d,Google_101636539682545301424,California,16,South Bay,10/10/2021,10:00:00 AM,2021-10-10T17:00:00.000Z,CC,93,Ballona Freshwater Marsh Outlet,33.970001,-118.433998,,68,Sunny,FALSE,,,,,=,134,,,,,,,,,,,,,,,2021-10-11T22:35:47.739Z
553114391,Import from legacy BWTF database,California,16,South Bay,2/9/2020,12:30:00 PM,2020-02-09T19:30:00Z,C,93,Ballona Freshwater Marsh Outlet,33.970001,-118.433998,,55,Partly_Cloudy,FALSE,,Not Applicable ft,,,=,85,,,,, ,,,,,,,,,,2020-03-09T18:48:45.000Z
553114055,Import from legacy BWTF database,California,16,South Bay,1/26/2020,12:30:00 PM,2020-01-26T19:30:00Z,C,93,Ballona Freshwater Marsh Outlet,33.970001,-118.433998,58,55,Partly_Cloudy,FALSE,,,,,=,160,,,,, ,,,,,,,,,,2020-03-09T18:48:43.000Z
553113691,Import from legacy BWTF database,California,16,South Bay,1/12/2020,12:30:00 PM,2020-01-12T19:30:00Z,C,93,Ballona Freshwater Marsh Outlet,33.970001,-118.433998,63,55,Sunny,FALSE,,Not Applicable ft,,,=,109,,,,, ,,,,,,,,,,2020-03-09T18:48:41.000Z
553113186,Import from legacy BWTF database,California,16,South Bay,12/15/2019,12:30:00 PM,2019-12-15T19:30:00Z,C,93,Ballona Freshwater Marsh Outlet,33.970001,-118.433998,63,55,Sunny,FALSE,,Not Applicable ft,,,=,813,,,,, ,,,,,,,,,,2020-03-09T18:48:38.000Z
553112835,Import from legacy BWTF database,California,16,South Bay,12/1/2019,12:30:00 PM,2019-12-01T19:30:00Z,C,93,Ballona Freshwater Marsh Outlet,33.970001,-118.433998,63,55,Overcast,TRUE,,Not Applicable ft,,,=,519,,,,, ,,,,,,,,,,2020-03-09T18:48:36.000Z
553112480,Import from legacy BWTF database,California,16,South Bay,11/17/2019,12:30:00 PM,2019-11-17T19:30:00Z,C,93,Ballona Freshwater Marsh Outlet,33.970001,-118.433998,63,85,Sunny,FALSE,medium,Not Applicable ft,,,=,216,,,,, ,,,,,,,,,,2020-03-09T18:48:34.000Z
553112131,Import from legacy BWTF database,California,16,South Bay,11/3/2019,12:30:00 PM,2019-11-03T19:30:00Z,C,93,Ballona Freshwater Marsh Outlet,33.970001,-118.433998,73,75,Sunny,TRUE,,Not Applicable ft,,,=,160,,,,, ,,,,,,,,,,2020-03-09T18:48:32.000Z
553111837,Import from legacy BWTF database,California,16,South Bay,10/20/2019,11:30:00 AM,2019-10-20T18:30:00Z,C,93,Ballona Freshwater Marsh Outlet,33.970001,-118.433998,73,75,Sunny,FALSE,,Not Applicable ft,,,=,135,,,,, ,,,,,,,,,,2020-03-09T18:48:30.000Z
553111606,Import from legacy BWTF database,California,16,South Bay,10/6/2019,11:30:00 AM,2019-10-06T18:30:00Z,C,93,Ballona Freshwater Marsh Outlet,33.970001,-118.433998,73,75,Sunny,FALSE,,Not Applicable ft,,,=,275,,,,, ,,,,,,,,,,2020-03-09T18:48:29.000Z
553108599,Import from legacy BWTF database,California,16,South Bay,5/19/2019,11:30:00 AM,2019-05-19T18:30:00Z,C,93,Ballona Freshwater Marsh Outlet,33.970001,-118.433998,58,55,Overcast,TRUE,,Not Applicable ft,,,=,537,,,,, ,,,,,,,,,,2020-03-09T18:47:01.000Z
553108207,Import from legacy BWTF database,California,16,South Bay,5/5/2019,11:30:00 AM,2019-05-05T18:30:00Z,C,93,Ballona Freshwater Marsh Outlet,33.970001,-118.433998,68,65,Partly_Cloudy,FALSE,,Not Applicable ft,,,=,52,,,,, ,,,,,,,,,,2020-03-09T18:46:58.000Z
553108065,Import from legacy BWTF database,California,16,South Bay,4/28/2019,11:30:00 AM,2019-04-28T18:30:00Z,C,93,Ballona Freshwater Marsh Outlet,33.970001,-118.433998,68,55,Overcast,FALSE,,Not Applicable ft,,,=,122,,,,, ,,,,,,,,,,2020-03-09T18:46:58.000Z
553107933,Import from legacy BWTF database,California,16,South Bay,4/14/2019,11:30:00 AM,2019-04-14T18:30:00Z,C,93,Ballona Freshwater Marsh Outlet,33.970001,-118.433998,68,65,Partly_Cloudy,TRUE,,Not Applicable ft,,,=,216,,,,, ,,,,,,,,,,2020-03-09T18:46:57.000Z
553107325,Import from legacy BWTF database,California,16,South Bay,3/24/2019,11:30:00 AM,2019-03-24T18:30:00Z,C,93,Ballona Freshwater Marsh Outlet,33.970001,-118.433998,63,65,Partly_Cloudy,FALSE,low,Not Applicable ft,,,=,73,,,,, ,,,,,,,,,,2020-03-09T18:46:53.000Z
553107087,Import from legacy BWTF database,California,16,South Bay,3/10/2019,11:30:00 AM,2019-03-10T18:30:00Z,C,93,Ballona Freshwater Marsh Outlet,33.970001,-118.433998,58,55,Partly_Cloudy,FALSE,,Not Applicable ft,,,=,30,,,,, ,,,,,,,,,,2020-03-09T18:46:52.000Z
553106749,Import from legacy BWTF database,California,16,South Bay,2/24/2019,12:30:00 PM,2019-02-24T19:30:00Z,C,93,Ballona Freshwater Marsh Outlet,33.970001,-118.433998,58,55,Sunny,FALSE,,Not Applicable ft,,,=,98,,,,, ,,,,,,,,,,2020-03-09T18:46:50.000Z
553106576,Import from legacy BWTF database,California,16,South Bay,2/10/2019,12:30:00 PM,2019-02-10T19:30:00Z,C,93,Ballona Freshwater Marsh Outlet,33.970001,-118.433998,58,55,Partly_Cloudy,TRUE,medium,Not Applicable ft,,,=,24195,,,,, ,,,,,,,,,,2020-03-09T18:46:49.000Z
553106141,Import from legacy BWTF database,California,16,South Bay,1/27/2019,12:30:00 PM,2019-01-27T19:30:00Z,C,93,Ballona Freshwater Marsh Outlet,33.970001,-118.433998,68,65,Partly_Cloudy,FALSE,medium,Not Applicable ft,,,=,589,,,,, ,,,,,,,,,,2020-03-09T18:46:47.000Z
553105923,Import from legacy BWTF database,California,16,South Bay,1/13/2019,11:30:00 AM,2019-01-13T18:30:00Z,C,93,Ballona Freshwater Marsh Outlet,33.970001,-118.433998,58,55,Partly_Cloudy,TRUE,low,Not Applicable ft,,,=,1483,,,,, ,,,,,,,,,,2020-03-09T18:46:45.000Z
553105400,Import from legacy BWTF database,California,16,South Bay,12/16/2018,11:30:00 AM,2018-12-16T18:30:00Z,Craig C.,93,Ballona Freshwater Marsh Outlet,33.970001,-118.433998,68,65,Partly_Cloudy,FALSE,medium,Not Applicable ft,,,=,118,,,,, ,,,,,,,,,,2020-03-09T18:46:43.000Z
553105057,Import from legacy BWTF database,California,16,South Bay,12/2/2018,11:30:00 AM,2018-12-02T18:30:00Z,Craig C.,93,Ballona Freshwater Marsh Outlet,33.970001,-118.433998,63,65,Partly_Cloudy,TRUE,low,Not Applicable ft,,,=,504,,,,, ,,,,,,,,,,2020-03-09T18:46:41.000Z
553104650,Import from legacy BWTF database,California,16,South Bay,11/18/2018,11:30:00 AM,2018-11-18T18:30:00Z,Craig C.,93,Ballona Freshwater Marsh Outlet,33.970001,-118.433998,68,65,Partly_Cloudy,FALSE,medium,Not Applicable ft,,,=,119,,,,, ,,,,,,,,,,2020-03-09T18:46:38.000Z
553104361,Import from legacy BWTF database,California,16,South Bay,11/4/2018,11:30:00 AM,2018-11-04T18:30:00Z,Craig C.,93,Ballona Freshwater Marsh Outlet,33.970001,-118.433998,68,65,Fog,FALSE,low,Not Applicable ft,,,=,1067,,,,, ,,,,,,,,,,2020-03-09T18:46:37.000Z
553104113,Import from legacy BWTF database,California,16,South Bay,10/21/2018,9:30:00 AM,2018-10-21T16:30:00Z,Craig C.,93,Ballona Freshwater Marsh Outlet,33.970001,-118.433998,68,65,Sunny,FALSE,medium,Not Applicable ft,,,=,8664,,,,, ,,,,,,,,,,2020-03-09T18:46:35.000Z
553103791,Import from legacy BWTF database,California,16,South Bay,10/7/2018,8:30:00 AM,2018-10-07T15:30:00Z,Craig C.,93,Ballona Freshwater Marsh Outlet,33.970001,-118.433998,68,65,Sunny,TRUE,high,Not Applicable ft,,,=,24195,,,,, ,,,,,,,,,,2020-03-09T18:46:33.000Z
553101152,Import from legacy BWTF database,California,16,South Bay,5/13/2018,10:30:00 AM,2018-05-13T17:30:00Z,Craig C.,93,Ballona Freshwater Marsh Outlet,33.970001,-118.433998,58,65,Sunny,FALSE,high,Not Applicable ft,,,=,1112,,,,, ,,,,,,,,,,2020-03-09T18:46:18.000Z
553100427,Import from legacy BWTF database,California,16,South Bay,4/8/2018,10:30:00 AM,2018-04-08T17:30:00Z,Craig C.,93,Ballona Freshwater Marsh Outlet,33.970001,-118.433998,58,65,Sunny,FALSE,high,Not Applicable ft,,,=,97,,,,, ,,,,,,,,,,2020-03-09T18:45:41.000Z
553099757,Import from legacy BWTF database,California,16,South Bay,3/18/2018,10:30:00 AM,2018-03-18T17:30:00Z,Craig C.,93,Ballona Freshwater Marsh Outlet,33.970001,-118.433998,58,55,Partly_Cloudy,TRUE,high,Not Applicable ft,,,=,2053,,,,, ,,,,,,,,,,2020-03-09T18:45:37.000Z
553099461,Import from legacy BWTF database,California,16,South Bay,3/4/2018,11:30:00 AM,2018-03-04T18:30:00Z,Craig C.,93,Ballona Freshwater Marsh Outlet,33.970001,-118.433998,58,65,Partly_Cloudy,TRUE,high,Not Applicable ft,,,=,808,,,,, ,,,,,,,,,,2020-03-09T18:45:35.000Z
553099195,Import from legacy BWTF database,California,16,South Bay,2/18/2018,10:30:00 AM,2018-02-18T17:30:00Z,Craig C.,93,Ballona Freshwater Marsh Outlet,33.970001,-118.433998,58,65,Sunny,FALSE,high,Not Applicable ft,,,=,337,,,,, ,,,,,,,,,,2020-03-09T18:45:34.000Z
553098940,Import from legacy BWTF database,California,16,South Bay,2/5/2018,12:30:00 PM,2018-02-05T19:30:00Z,Craig C. ,93,Ballona Freshwater Marsh Outlet,33.970001,-118.433998,58,65,Partly_Cloudy,FALSE,high,Not Applicable ft,,,=,2198,,,,, ,,,,,,,,,,2020-03-09T18:45:32.000Z
553098717,Import from legacy BWTF database,California,16,South Bay,1/22/2018,12:30:00 PM,2018-01-22T19:30:00Z,Craig C.,93,Ballona Freshwater Marsh Outlet,33.970001,-118.433998,58,65,Partly_Cloudy,TRUE,high,Not Applicable ft,,,=,178,,,,, ,,,,,,,,,,2020-03-09T18:45:31.000Z
553098431,Import from legacy BWTF database,California,16,South Bay,1/7/2018,11:30:00 AM,2018-01-07T18:30:00Z,Craig C.,93,Ballona Freshwater Marsh Outlet,33.970001,-118.433998,63,65,Partly_Cloudy,FALSE,low,Not Applicable ft,,,=,41,,,,, ,,,,,,,,,,2020-03-09T18:45:29.000Z
553098083,Import from legacy BWTF database,California,16,South Bay,12/10/2017,11:30:00 AM,2017-12-10T18:30:00Z,Craig C.,93,Ballona Freshwater Marsh Outlet,33.970001,-118.433998,58,75,Sunny,TRUE,low,Not Applicable ft,,,=,20,,,,, ,,,,,,,,,,2020-03-09T18:45:27.000Z
553097685,Import from legacy BWTF database,California,16,South Bay,11/19/2017,11:30:00 AM,2017-11-19T18:30:00Z,Craig C.,93,Ballona Freshwater Marsh Outlet,33.970001,-118.433998,63,65,Sunny,FALSE,high,Not Applicable ft,,,=,155,,,,, ,,,,,,,,,,2020-03-09T18:45:25.000Z
553097328,Import from legacy BWTF database,California,16,South Bay,11/5/2017,11:30:00 AM,2017-11-05T18:30:00Z,Craig C.,93,Ballona Freshwater Marsh Outlet,33.970001,-118.433998,68,65,Partly_Cloudy,TRUE,high,Not Applicable ft,,,=,591,,,,, ,,,,,,,,,,2020-03-09T18:45:23.000Z
553097102,Import from legacy BWTF database,California,16,South Bay,10/22/2017,9:30:00 AM,2017-10-22T16:30:00Z,Craig C.,93,Ballona Freshwater Marsh Outlet,33.970001,-118.433998,68,75,,FALSE,high,Not Applicable ft,,,=,1785,,,,, ,,,,,,,,,,2020-03-09T18:45:22.000Z
553096867,Import from legacy BWTF database,California,16,South Bay,10/2/2017,10:30:00 AM,2017-10-02T17:30:00Z,Craig C.,93,Ballona Freshwater Marsh Outlet,33.970001,-118.433998,68,65,Sunny,FALSE,high,Not Applicable ft,,,=,1354,,,,, ,,,,,,,,,,2020-03-09T18:45:21.000Z
553094191,Import from legacy BWTF database,California,16,South Bay,4/23/2017,10:30:00 AM,2017-04-23T17:30:00Z,Craig C.,93,Ballona Freshwater Marsh Outlet,33.970001,-118.433998,63,65,Sunny,FALSE,high,>12 ft,,,=,21,,,,, ,,,,,,,,,,2020-03-09T18:45:06.000Z
553093936,Import from legacy BWTF database,California,16,South Bay,4/9/2017,10:30:00 AM,2017-04-09T17:30:00Z,Craig C.,93,Ballona Freshwater Marsh Outlet,33.970001,-118.433998,58,55,Sunny,TRUE,high,Not Applicable ft,,,=,2500,,,,, ,,,,,,,,,,2020-03-09T18:45:04.000Z
553093709,Import from legacy BWTF database,California,16,South Bay,3/26/2017,10:30:00 AM,2017-03-26T17:30:00Z,Craig C.,93,Ballona Freshwater Marsh Outlet,33.970001,-118.433998,58,55,Partly_Cloudy,FALSE,high,Not Applicable ft,,,=,21,,,,, ,,,,,,,,,,2020-03-09T18:45:03.000Z
553093518,Import from legacy BWTF database,California,16,South Bay,3/12/2017,10:30:00 AM,2017-03-12T17:30:00Z,Craig C.,93,Ballona Freshwater Marsh Outlet,33.970001,-118.433998,58,55,Overcast,FALSE,high,Not Applicable ft,,,=,21,,,,, ,,,,,,,,,,2020-03-09T18:45:02.000Z
553093199,Import from legacy BWTF database,California,16,South Bay,2/26/2017,11:30:00 AM,2017-02-26T18:30:00Z,Craig C.,93,Ballona Freshwater Marsh Outlet,33.970001,-118.433998,58,55,Light_Rain,TRUE,high,Not Applicable ft,,,=,130,,,,, ,,,,,,,,,,2020-03-09T18:45:00.000Z
553093016,Import from legacy BWTF database,California,16,South Bay,2/12/2017,11:30:00 AM,2017-02-12T18:30:00Z,Craig C.,93,Ballona Freshwater Marsh Outlet,33.970001,-118.433998,58,55,Partly_Cloudy,TRUE,high,Not Applicable ft,,,=,10,,,,, ,,,,,,,,,,2020-03-09T18:44:59.000Z
553092630,Import from legacy BWTF database,California,16,South Bay,1/22/2017,11:30:00 AM,2017-01-22T18:30:00Z,Craig C.,93,Ballona Freshwater Marsh Outlet,33.970001,-118.433998,58,55,Heavy_Rain,TRUE,medium,Not Applicable ft,,,=,182,,,,, ,,,,,,,,,,2020-03-09T18:44:57.000Z
553092410,Import from legacy BWTF database,California,16,South Bay,1/8/2017,11:30:00 AM,2017-01-08T18:30:00Z,Craig C.,93,Ballona Freshwater Marsh Outlet,33.970001,-118.433998,58,65,Partly_Cloudy,TRUE,low,Not Applicable ft,,,=,295,,,,, ,,,,,,,,,,2020-03-09T18:44:55.000Z
553091918,Import from legacy BWTF database,California,16,South Bay,12/4/2016,11:30:00 AM,2016-12-04T18:30:00Z,Craig C.,93,Ballona Freshwater Marsh Outlet,33.970001,-118.433998,58,55,Sunny,FALSE,medium,Not Applicable ft,,,=,95,,,,, ,,,,,,,,,,2020-03-09T18:44:53.000Z
553091725,Import from legacy BWTF database,California,16,South Bay,11/20/2016,11:30:00 AM,2016-11-20T18:30:00Z,Craig C.,93,Ballona Freshwater Marsh Outlet,33.970001,-118.433998,68,65,Light_Rain,TRUE,medium,Not Applicable ft,,,=,714,,,,, ,,,,,,,,,,2020-03-09T18:44:52.000Z
553091403,Import from legacy BWTF database,California,16,South Bay,11/6/2016,11:30:00 AM,2016-11-06T18:30:00Z,Craig,93,Ballona Freshwater Marsh Outlet,33.970001,-118.433998,63,65,Fog,FALSE,medium,Not Applicable ft,,,=,3255,,,,, ,,,,,,,,,,2020-03-09T18:44:50.000Z
553090979,Import from legacy BWTF database,California,16,South Bay,10/9/2016,10:30:00 AM,2016-10-09T17:30:00Z,Craig,93,Ballona Freshwater Marsh Outlet,33.970001,-118.433998,68,75,Sunny,FALSE,medium,0.5 ft,,,=,19863,,,,, ,,,,,,,,,,2020-03-09T18:44:48.000Z
553088868,Import from legacy BWTF database,California,16,South Bay,5/1/2016,10:30:00 AM,2016-05-01T17:30:00Z,Craig C.,93,Ballona Freshwater Marsh Outlet,33.970001,-118.433998,58,65,Partly_Cloudy,FALSE,low,Not Applicable ft,,,=,61,,,,, ,,,,,,,,,,2020-03-09T18:42:34.000Z
553088556,Import from legacy BWTF database,California,16,South Bay,4/15/2016,9:30:00 AM,2016-04-15T16:30:00Z,Craig C.,93,Ballona Freshwater Marsh Outlet,33.970001,-118.433998,58,65,Sunny,,high,Not Applicable ft,,,=,41,,,,, ,,,,,,,,,,2020-03-09T18:42:32.000Z
553088379,Import from legacy BWTF database,California,16,South Bay,4/3/2016,10:30:00 AM,2016-04-03T17:30:00Z,CRAIG C.,93,Ballona Freshwater Marsh Outlet,33.970001,-118.433998,58,55,Partly_Cloudy,FALSE,medium,Not Applicable ft,,,=,52,,,,, ,,,,,,,,,,2020-03-09T18:42:32.000Z
553088178,Import from legacy BWTF database,California,16,South Bay,3/20/2016,10:30:00 AM,2016-03-20T17:30:00Z,CRAIG C.,93,Ballona Freshwater Marsh Outlet,33.970001,-118.433998,58,65,Partly_Cloudy,FALSE,medium,Not Applicable ft,,,=,120,,,,, ,,,,,,,,,,2020-03-09T18:42:31.000Z
553087920,Import from legacy BWTF database,California,16,South Bay,3/6/2016,11:30:00 AM,2016-03-06T18:30:00Z,CRAIG C.,93,Ballona Freshwater Marsh Outlet,33.970001,-118.433998,58,55,Light_Rain,TRUE,high,Not Applicable ft,,,=,581,,,,, ,,,,,,,,,,2020-03-09T18:42:29.000Z
553087939,Import from legacy BWTF database,California,16,South Bay,3/6/2016,11:30:00 AM,2016-03-06T18:30:00Z,CRAIG C.,93,Ballona Freshwater Marsh Outlet,33.970001,-118.433998,58,55,Partly_Cloudy,TRUE,high,Not Applicable ft,,,=,581,,,,, ,,,,,,,,,,2020-03-09T18:42:30.000Z
553087491,Import from legacy BWTF database,California,16,South Bay,2/21/2016,11:30:00 AM,2016-02-21T18:30:00Z,Craig C.,93,Ballona Freshwater Marsh Outlet,33.970001,-118.433998,58,55,Sunny,,high,Not Applicable ft,,,=,148,,,,, ,,,,,,,,,,2020-03-09T18:42:28.000Z
553087336,Import from legacy BWTF database,California,16,South Bay,2/7/2016,11:30:00 AM,2016-02-07T18:30:00Z,CRAIG C.,93,Ballona Freshwater Marsh Outlet,33.970001,-118.433998,58,75,Sunny,FALSE,high,Not Applicable ft,,,=,10,,,,, ,,,,,,,,,,2020-03-09T18:42:27.000Z
553087121,Import from legacy BWTF database,California,16,South Bay,1/24/2016,11:30:00 AM,2016-01-24T18:30:00Z,Craig C.,93,Ballona Freshwater Marsh Outlet,33.970001,-118.433998,63,65,Sunny,TRUE,high,Not Applicable ft,,,=,41,,,,, ,,,,,,,,,,2020-03-09T18:42:26.000Z
553086975,Import from legacy BWTF database,California,16,South Bay,1/10/2016,11:30:00 AM,2016-01-10T18:30:00Z,CRAIG C.,93,Ballona Freshwater Marsh Outlet,33.970001,-118.433998,58,55,Partly_Cloudy,TRUE,high,Not Applicable ft,,,=,161,,,,, ,,,,,,,,,,2020-03-09T18:42:25.000Z
553086596,Import from legacy BWTF database,California,16,South Bay,12/6/2015,11:30:00 AM,2015-12-06T18:30:00Z,CRAIG C.,93,Ballona Freshwater Marsh Outlet,33.970001,-118.433998,63,65,Partly_Cloudy,FALSE,high,Not Applicable ft,,,=,96,,,,, ,,,,,,,,,,2020-03-09T18:42:23.000Z
553086395,Import from legacy BWTF database,California,16,South Bay,11/15/2015,11:30:00 AM,2015-11-15T18:30:00Z,Craig C.,93,Ballona Freshwater Marsh Outlet,33.970001,-118.433998,63,65,Partly_Cloudy,FALSE,high,Not Applicable ft,,,=,573,,,,, ,,,,,,,,,,2020-03-09T18:42:23.000Z
553086190,Import from legacy BWTF database,California,16,South Bay,11/1/2015,11:30:00 AM,2015-11-01T18:30:00Z,Craig C.,93,Ballona Freshwater Marsh Outlet,33.970001,-118.433998,68,75,Sunny,FALSE,high,Not Applicable ft,,,=,5172,,,,, ,,,,,,,,,,2020-03-09T18:42:22.000Z
553086001,Import from legacy BWTF database,California,16,South Bay,10/18/2015,10:30:00 AM,2015-10-18T17:30:00Z,Craig C.,93,Ballona Freshwater Marsh Outlet,33.970001,-118.433998,73,65,Partly_Cloudy,TRUE,high,Not Applicable ft,,,=,120,,,,, ,,,,,,,,,,2020-03-09T18:42:21.000Z
553085794,Import from legacy BWTF database,California,16,South Bay,10/4/2015,10:30:00 AM,2015-10-04T17:30:00Z,Craig C.,93,Ballona Freshwater Marsh Outlet,33.970001,-118.433998,73,65,Overcast,TRUE,low,Not Applicable ft,,,=,146,,,,, ,,,,,,,,,,2020-03-09T18:42:20.000Z
553083694,Import from legacy BWTF database,California,16,South Bay,4/26/2015,10:30:00 AM,2015-04-26T17:30:00Z,Craig C.,93,Ballona Freshwater Marsh Outlet,33.970001,-118.433998,58,65,Sunny,TRUE,low,Not Applicable ft,,,=,86,,,,, ,,,,,,,,,,2020-03-09T18:41:14.000Z
553083536,Import from legacy BWTF database,California,16,South Bay,4/12/2015,10:30:00 AM,2015-04-12T17:30:00Z,Craig C.,93,Ballona Freshwater Marsh Outlet,33.970001,-118.433998,58,65,Sunny,FALSE,low,Not Applicable ft,,,=,97,,,,, ,,,,,,,,,,2020-03-09T18:41:13.000Z
553083288,Import from legacy BWTF database,California,16,South Bay,3/22/2015,10:30:00 AM,2015-03-22T17:30:00Z,Craig C.,93,Ballona Freshwater Marsh Outlet,33.970001,-118.433998,58,75,Sunny,FALSE,high,Not Applicable ft,,,=,62,,,,, ,,,,,,,,,,2020-03-09T18:41:11.000Z
553083173,Import from legacy BWTF database,California,16,South Bay,3/8/2015,10:30:00 AM,2015-03-08T17:30:00Z,Craig C.,93,Ballona Freshwater Marsh Outlet,33.970001,-118.433998,58,65,Sunny,FALSE,high,Not Applicable ft,,,=,20,,,,, ,,,,,,,,,,2020-03-09T18:41:11.000Z
553082855,Import from legacy BWTF database,California,16,South Bay,2/22/2015,11:30:00 AM,2015-02-22T18:30:00Z,Craig C.,93,Ballona Freshwater Marsh Outlet,33.970001,-118.433998,58,65,Light_Rain,TRUE,high,,,,=,30,,,,, ,,,,,,,,,,2020-03-09T18:41:09.000Z
553082716,Import from legacy BWTF database,California,16,South Bay,2/8/2015,11:30:00 AM,2015-02-08T18:30:00Z,Craig C.,93,Ballona Freshwater Marsh Outlet,33.970001,-118.433998,58,65,Partly_Cloudy,TRUE,low,Not Applicable ft,,,=,52,,,,, ,,,,,,,,,,2020-03-09T18:41:08.000Z
553082550,Import from legacy BWTF database,California,16,South Bay,1/25/2015,11:30:00 AM,2015-01-25T18:30:00Z,Craig C.,93,Ballona Freshwater Marsh Outlet,33.970001,-118.433998,58,75,Sunny,FALSE,low,Not Applicable ft,,,=,63,,,,, ,,,,,,,,,,2020-03-09T18:41:06.000Z
553082212,Import from legacy BWTF database,California,16,South Bay,1/11/2015,11:30:00 AM,2015-01-11T18:30:00Z,Craig C.,93,Ballona Freshwater Marsh Outlet,33.970001,-118.433998,58,55,Light_Rain,TRUE,,Not Applicable ft,,,=,3076,,,,, ,,,,,,,,,,2020-03-09T18:41:03.000Z
553081930,Import from legacy BWTF database,California,16,South Bay,12/14/2014,11:30:00 AM,2014-12-14T18:30:00Z,Craig C.,93,Ballona Freshwater Marsh Outlet,33.970001,-118.433998,63,55,Sunny,TRUE,medium,Not Applicable ft,,,>,24196,,,,, ,,,,,,,,,,2020-03-09T18:40:50.000Z
553081727,Import from legacy BWTF database,California,16,South Bay,11/30/2014,11:30:00 AM,2014-11-30T18:30:00Z,Craig C.,93,Ballona Freshwater Marsh Outlet,33.970001,-118.433998,68,65,Partly_Cloudy,TRUE,,Not Applicable ft,,,=,1046,,,,, ,,,,,,,,,,2020-03-09T18:40:49.000Z
553081559,Import from legacy BWTF database,California,16,South Bay,11/16/2014,11:30:00 AM,2014-11-16T18:30:00Z,Craig ,93,Ballona Freshwater Marsh Outlet,33.970001,-118.433998,68,65,Sunny,TRUE,low,Not Applicable ft,,,=,620,,,,, ,,,,,,,,,,2020-03-09T18:40:48.000Z
553081361,Import from legacy BWTF database,California,16,South Bay,11/2/2014,11:30:00 AM,2014-11-02T18:30:00Z,Craig,93,Ballona Freshwater Marsh Outlet,33.970001,-118.433998,68,65,Sunny,TRUE,low,Not Applicable ft,,,=,3129,,,,, ,,,,,,,,,,2020-03-09T18:40:47.000Z
553079502,Import from legacy BWTF database,California,16,South Bay,4/27/2014,10:30:00 AM,2014-04-27T17:30:00Z,Craig C.,93,Ballona Freshwater Marsh Outlet,33.970001,-118.433998,63,65,Sunny,TRUE,,,,,=,155,,,,, ,,,,,,,,,,2020-03-09T18:40:30.000Z
553079252,Import from legacy BWTF database,California,16,South Bay,4/13/2014,11:30:00 AM,2014-04-13T18:30:00Z,Craig,93,Ballona Freshwater Marsh Outlet,33.970001,-118.433998,63,65,Partly_Cloudy,,,Not Applicable ft,,,=,61,,,,, ,,,,,,,,,,2020-03-09T18:38:48.000Z
553079043,Import from legacy BWTF database,California,16,South Bay,3/23/2014,11:30:00 AM,2014-03-23T18:30:00Z,Craig C.,93,Ballona Freshwater Marsh Outlet,33.970001,-118.433998,63,65,Sunny,FALSE,,Not Applicable ft,,,=,97,,,,, ,,,,,,,,,,2020-03-09T18:38:42.000Z
553078797,Import from legacy BWTF database,California,16,South Bay,3/9/2014,10:30:00 AM,2014-03-09T17:30:00Z,Craig C.,93,Ballona Freshwater Marsh Outlet,33.970001,-118.433998,58,75,Sunny,FALSE,,Not Applicable ft,,,=,420,,,,, ,,,,,,,,,,2020-03-09T18:38:34.000Z
553078482,Import from legacy BWTF database,California,16,South Bay,2/9/2014,12:30:00 PM,2014-02-09T19:30:00Z,Craig C.,93,Ballona Freshwater Marsh Outlet,33.970001,-118.433998,58,65,Sunny,TRUE,,Not Applicable ft,,,=,2616,,,,, ,,,,,,,,,,2020-03-09T18:38:30.000Z
553078241,Import from legacy BWTF database,California,16,South Bay,1/26/2014,12:30:00 PM,2014-01-26T19:30:00Z,Craig C.,93,Ballona Freshwater Marsh Outlet,33.970001,-118.433998,58,65,Partly_Cloudy,FALSE,,Not Applicable ft,,,=,426,,,,, ,,,,,,,,,,2020-03-09T18:38:20.000Z
553078057,Import from legacy BWTF database,California,16,South Bay,1/12/2014,12:30:00 PM,2014-01-12T19:30:00Z,Craig C.,93,Ballona Freshwater Marsh Outlet,33.970001,-118.433998,58,65,Sunny,FALSE,high,Not Applicable ft,,,=,41,,,,, ,,,,,,,,,,2020-03-09T18:38:19.000Z
553077780,Import from legacy BWTF database,California,16,South Bay,12/8/2013,12:30:00 PM,2013-12-08T19:30:00Z,Craig C.,93,Ballona Freshwater Marsh Outlet,33.970001,-118.433998,63,45,Sunny,TRUE,,Not Applicable ft,,,=,2480,,,,, ,,,,,,,,,,2020-03-09T18:38:18.000Z
553077613,Import from legacy BWTF database,California,16,South Bay,11/17/2013,11:30:00 AM,2013-11-17T18:30:00Z,Craig C.,93,Ballona Freshwater Marsh Outlet,33.970001,-118.433998,63,65,Partly_Cloudy,FALSE,,,,,=,805,,,,, ,,,,,,,,,,2020-03-09T18:38:07.000Z
553077470,Import from legacy BWTF database,California,16,South Bay,11/3/2013,12:30:00 PM,2013-11-03T19:30:00Z,Craig C.,93,Ballona Freshwater Marsh Outlet,33.970001,-118.433998,63,65,Sunny,FALSE,,Not Applicable ft,,,=,134,,,,, ,,,,,,,,,,2020-03-09T18:38:02.000Z
553077374,Import from legacy BWTF database,California,16,South Bay,10/20/2013,11:30:00 AM,2013-10-20T18:30:00Z,Craig C.,93,Ballona Freshwater Marsh Outlet,33.970001,-118.433998,63,65,Sunny,FALSE,,Not Applicable ft,,,=,183,,,,, ,,,,,,,,,,2020-03-09T18:38:02.000Z
553077167,Import from legacy BWTF database,California,16,South Bay,10/6/2013,10:30:00 AM,2013-10-06T17:30:00Z,C. Cadwallader,93,Ballona Freshwater Marsh Outlet,33.970001,-118.433998,68,85,Sunny,FALSE,,Not Applicable ft,,,=,41,,,,, ,,,,,,,,,,2020-03-09T18:38:01.000Z
553076057,Import from legacy BWTF database,California,16,South Bay,4/28/2013,10:30:00 AM,2013-04-28T17:30:00Z,C.C.,93,Ballona Freshwater Marsh Outlet,33.970001,-118.433998,58,65,Sunny,FALSE,,Not Applicable ft,,,=,798,,,,, ,,,,,,,,,,2020-03-09T18:37:56.000Z
553075925,Import from legacy BWTF database,California,16,South Bay,4/14/2013,10:30:00 AM,2013-04-14T17:30:00Z,H S Students,93,Ballona Freshwater Marsh Outlet,33.970001,-118.433998,58,65,Sunny,FALSE,,Not Applicable ft,,,=,10,,,,, ,,,,,,,,,,2020-03-09T18:37:47.000Z
553075566,Import from legacy BWTF database,California,16,South Bay,3/17/2013,10:30:00 AM,2013-03-17T17:30:00Z,student,93,Ballona Freshwater Marsh Outlet,33.970001,-118.433998,,65,Sunny,FALSE,,,,,=,74,,,,, ,,,,,,,,,,2020-03-09T18:37:46.000Z
553075350,Import from legacy BWTF database,California,16,South Bay,3/3/2013,12:30:00 PM,2013-03-03T19:30:00Z,student,93,Ballona Freshwater Marsh Outlet,33.970001,-118.433998,,,Partly_Cloudy,FALSE,,,,,=,41,,,,, ,,,,,,,,,,2020-03-09T18:37:45.000Z
553075166,Import from legacy BWTF database,California,16,South Bay,2/17/2013,12:30:00 PM,2013-02-17T19:30:00Z,student,93,Ballona Freshwater Marsh Outlet,33.970001,-118.433998,,,Sunny,FALSE,,,,,=,30,,,,, ,,,,,,,,,,2020-03-09T18:37:44.000Z
553074938,Import from legacy BWTF database,California,16,South Bay,2/3/2013,11:30:00 AM,2013-02-03T18:30:00Z,H S Students,93,Ballona Freshwater Marsh Outlet,33.970001,-118.433998,53,55,Sunny,FALSE,high,Not Applicable ft,,,=,20,,,,, ,,,,,,,,,,2020-03-09T18:37:39.000Z
553074812,Import from legacy BWTF database,California,16,South Bay,1/20/2013,12:30:00 PM,2013-01-20T19:30:00Z,H S Students,93,Ballona Freshwater Marsh Outlet,33.970001,-118.433998,58,65,Sunny,FALSE,,Not Applicable ft,,,=,10,,,,, ,,,,,,,,,,2020-03-09T18:37:39.000Z
553074695,Import from legacy BWTF database,California,16,South Bay,1/6/2013,11:30:00 AM,2013-01-06T18:30:00Z,HS students,93,Ballona Freshwater Marsh Outlet,33.970001,-118.433998,58,55,Light_Rain,TRUE,,Not Applicable ft,,,<,10,,,,, ,,,,,,,,,,2020-03-09T18:37:38.000Z
553074564,Import from legacy BWTF database,California,16,South Bay,12/16/2012,12:30:00 PM,2012-12-16T19:30:00Z,student,93,Ballona Freshwater Marsh Outlet,33.970001,-118.433998,,,Light_Rain,TRUE,,,,,=,52,,,,, ,,,,,,,,,,2020-03-09T18:37:38.000Z
553074378,Import from legacy BWTF database,California,16,South Bay,12/2/2012,12:30:00 PM,2012-12-02T19:30:00Z,student,93,Ballona Freshwater Marsh Outlet,33.970001,-118.433998,,65,Light_Rain,TRUE,,,,,=,1169,,,,, ,,,,,,,,,,2020-03-09T18:37:37.000Z
553074258,Import from legacy BWTF database,California,16,South Bay,11/18/2012,12:30:00 PM,2012-11-18T19:30:00Z,Craig C.,93,Ballona Freshwater Marsh Outlet,33.970001,-118.433998,58,55,Light_Rain,TRUE,,Not Applicable ft,,,=,203,,,,, ,,,,,,,,,,2020-03-09T18:37:36.000Z
553074030,Import from legacy BWTF database,California,16,South Bay,11/4/2012,12:30:00 PM,2012-11-04T19:30:00Z,H S Students,93,Ballona Freshwater Marsh Outlet,33.970001,-118.433998,68,75,Sunny,FALSE,,Not Applicable ft,,,=,1090,,,,, ,,,,,,,,,,2020-03-09T18:37:02.000Z
553073915,Import from legacy BWTF database,California,16,South Bay,10/21/2012,10:30:00 AM,2012-10-21T17:30:00Z,Craig C.,93,Ballona Freshwater Marsh Outlet,33.970001,-118.433998,68,65,Partly_Cloudy,TRUE,,Not Applicable ft,,,=,4786,,,,, ,,,,,,,,,,2020-03-09T18:37:01.000Z
553073835,Import from legacy BWTF database,California,16,South Bay,10/7/2012,10:30:00 AM,2012-10-07T17:30:00Z,HS Students,93,Ballona Freshwater Marsh Outlet,33.970001,-118.433998,73,75,,FALSE,,Not Applicable ft,,,=,74,,,,, ,,,,,,,,,,2020-03-09T18:37:01.000Z
553072707,Import from legacy BWTF database,California,16,South Bay,4/30/2012,12:30:00 PM,2012-04-30T19:30:00Z,Matt Waterworth,93,Ballona Freshwater Marsh Outlet,33.970001,-118.433998,,,,,,,,,=,30,,,,, ,,,,,,,,,,2020-03-09T18:36:54.000Z
553072642,Import from legacy BWTF database,California,16,South Bay,4/16/2012,12:30:00 PM,2012-04-16T19:30:00Z,Matt Waterworth,93,Ballona Freshwater Marsh Outlet,33.970001,-118.433998,,,,,,,,,=,10,,,,, ,,,,,,,,,,2020-03-09T18:36:54.000Z
553072554,Import from legacy BWTF database,California,16,South Bay,4/1/2012,11:30:00 AM,2012-04-01T18:30:00Z,HS Students,93,Ballona Freshwater Marsh Outlet,33.970001,-118.433998,,,Sunny,TRUE,,,,,=,30,,,,, ,,,,,,,,,,2020-03-09T18:36:53.000Z
553072434,Import from legacy BWTF database,California,16,South Bay,3/19/2012,12:30:00 PM,2012-03-19T19:30:00Z,Matt Waterworth,93,Ballona Freshwater Marsh Outlet,33.970001,-118.433998,,,,,,,,,=,231,,,,, ,,,,,,,,,,2020-03-09T18:36:53.000Z
553072205,Import from legacy BWTF database,California,16,South Bay,3/5/2012,12:30:00 PM,2012-03-05T19:30:00Z,Matt Waterworth,93,Ballona Freshwater Marsh Outlet,33.970001,-118.433998,,,,,,,,,=,20,,,,, ,,,,,,,,,,2020-03-09T18:36:47.000Z
553072098,Import from legacy BWTF database,California,16,South Bay,2/20/2012,12:30:00 PM,2012-02-20T19:30:00Z,Matt Waterworth,93,Ballona Freshwater Marsh Outlet,33.970001,-118.433998,,,,,,,,,=,72,,,,, ,,,,,,,,,,2020-03-09T18:36:46.000Z
553071775,Import from legacy BWTF database,California,16,South Bay,1/22/2012,11:30:00 AM,2012-01-22T18:30:00Z,Joe G.,93,Ballona Freshwater Marsh Outlet,33.970001,-118.433998,58,55,Light_Rain,TRUE,,,,,=,538,,,,,Fresh Water in to wet lands,,,,,,,,,,2020-03-09T18:36:44.000Z
553071690,Import from legacy BWTF database,California,16,South Bay,1/9/2012,12:30:00 PM,2012-01-09T19:30:00Z,Matt Waterworth,93,Ballona Freshwater Marsh Outlet,33.970001,-118.433998,,,,,,,,,=,110,,,,, ,,,,,,,,,,2020-03-09T18:36:44.000Z
553071623,Import from legacy BWTF database,California,16,South Bay,12/19/2011,1:30:00 PM,2011-12-19T20:30:00Z,Matt Waterworth,93,Ballona Freshwater Marsh Outlet,33.970001,-118.433998,,,,,,,,,<,10,,,,, ,,,,,,,,,,2020-03-09T18:36:44.000Z
553071549,Import from legacy BWTF database,California,16,South Bay,12/5/2011,12:30:00 PM,2011-12-05T19:30:00Z,Matt Waterworth,93,Ballona Freshwater Marsh Outlet,33.970001,-118.433998,,,,,,,,,=,30,,,,, ,,,,,,,,,,2020-03-09T18:36:43.000Z
553071285,Import from legacy BWTF database,California,16,South Bay,11/14/2011,12:30:00 PM,2011-11-14T19:30:00Z,Matt Waterworth,93,Ballona Freshwater Marsh Outlet,33.970001,-118.433998,,,,,,,,,=,1600,,,,, ,,,,,,,,,,2020-03-09T18:36:41.000Z
553071214,Import from legacy BWTF database,California,16,South Bay,10/31/2011,12:30:00 PM,2011-10-31T19:30:00Z,Matt Waterworth,93,Ballona Freshwater Marsh Outlet,33.970001,-118.433998,,,,,,,,,=,457,,,,, ,,,,,,,,,,2020-03-09T18:36:41.000Z
553071170,Import from legacy BWTF database,California,16,South Bay,10/17/2011,12:30:00 PM,2011-10-17T19:30:00Z,Matt Waterworth,93,Ballona Freshwater Marsh Outlet,33.970001,-118.433998,,,,,,,,,=,195,,,,, ,,,,,,,,,,2020-03-09T18:36:41.000Z
553070145,Import from legacy BWTF database,California,16,South Bay,4/16/2011,10:30:00 AM,2011-04-16T17:30:00Z,students,93,Ballona Freshwater Marsh Outlet,33.970001,-118.433998,,,,,,,,,=,156,,,,, ,,,,,,,,,,2020-03-09T18:36:32.000Z
453070372,Import from legacy BWTF database,California,16,South Bay,3/6/2011,11:30:00 AM,2011-03-06T18:30:00Z,students,93,Ballona Freshwater Marsh Outlet,33.970001,-118.433998,,,,,,,,,=,512,,,,, ,,,,,,,,,,2020-03-09T18:36:31.000Z
453070366,Import from legacy BWTF database,California,16,South Bay,2/20/2011,11:30:00 AM,2011-02-20T18:30:00Z,students,93,Ballona Freshwater Marsh Outlet,33.970001,-118.433998,,,,,,,,,=,813,,,,, ,,,,,,,,,,2020-03-09T18:36:31.000Z
453070360,Import from legacy BWTF database,California,16,South Bay,1/23/2011,11:30:00 AM,2011-01-23T18:30:00Z,students,93,Ballona Freshwater Marsh Outlet,33.970001,-118.433998,,,,,,,,,=,41,,,,, ,,,,,,,,,,2020-03-09T18:36:31.000Z
453070084,Import from legacy BWTF database,California,16,South Bay,1/9/2011,11:30:00 AM,2011-01-09T18:30:00Z,students,93,Ballona Freshwater Marsh Outlet,33.970001,-118.433998,,,,,,,,,=,84,,,,, ,,,,,,,,,,2020-03-09T18:36:29.000Z
453070094,Import from legacy BWTF database,California,16,South Bay,12/12/2010,11:30:00 AM,2010-12-12T18:30:00Z,students,93,Ballona Freshwater Marsh Outlet,33.970001,-118.433998,,,,,,,,,=,209,,,,, ,,,,,,,,,,2020-03-09T18:36:29.000Z
453070025,Import from legacy BWTF database,California,16,South Bay,12/5/2010,11:30:00 AM,2010-12-05T18:30:00Z,HS Students,93,Ballona Freshwater Marsh Outlet,33.970001,-118.433998,,,,FALSE,,,,,=,256,,,,, ,,,,,,,,,,2020-03-09T18:36:29.000Z
453069639,Import from legacy BWTF database,California,16,South Bay,10/31/2010,10:30:00 AM,2010-10-31T17:30:00Z,Students,93,Ballona Freshwater Marsh Outlet,33.970001,-118.433998,,,,,,,,,=,1295,,,,, ,,,,,,,,,,2020-03-09T18:36:23.000Z
453069632,Import from legacy BWTF database,California,16,South Bay,10/18/2010,10:30:00 AM,2010-10-18T17:30:00Z,Students,93,Ballona Freshwater Marsh Outlet,33.970001,-118.433998,,,,,,,,,=,24192,,,,, ,,,,,,,,,,2020-03-09T18:36:23.000Z
453069621,Import from legacy BWTF database,California,16,South Bay,10/3/2010,10:30:00 AM,2010-10-03T17:30:00Z,Students,93,Ballona Freshwater Marsh Outlet,33.970001,-118.433998,,,,,,,,,=,435,,,,, ,,,,,,,,,,2020-03-09T18:36:23.000Z
453068741,Import from legacy BWTF database,California,16,South Bay,4/26/2010,10:30:00 AM,2010-04-26T17:30:00Z,students,93,Ballona Freshwater Marsh Outlet,33.970001,-118.433998,,,,,,,,,=,63,,,,, ,,,,,,,,,,2020-03-09T18:36:20.000Z
453068653,Import from legacy BWTF database,California,16,South Bay,4/12/2010,10:30:00 AM,2010-04-12T17:30:00Z,students,93,Ballona Freshwater Marsh Outlet,33.970001,-118.433998,,,,,,,,,=,20,,,,, ,,,,,,,,,,2020-03-09T18:36:19.000Z
453068646,Import from legacy BWTF database,California,16,South Bay,3/21/2010,10:30:00 AM,2010-03-21T17:30:00Z,students,93,Ballona Freshwater Marsh Outlet,33.970001,-118.433998,,,,,,,,,=,20,,,,, ,,,,,,,,,,2020-03-09T18:36:19.000Z
453068468,Import from legacy BWTF database,California,16,South Bay,3/7/2010,11:30:00 AM,2010-03-07T18:30:00Z,students,93,Ballona Freshwater Marsh Outlet,33.970001,-118.433998,,,,,,,,,=,193,,,,, ,,,,,,,,,,2020-03-09T18:28:53.000Z
453068365,Import from legacy BWTF database,California,16,South Bay,2/21/2010,11:30:00 AM,2010-02-21T18:30:00Z,students,93,Ballona Freshwater Marsh Outlet,33.970001,-118.433998,,,,,,,,,=,31,,,,, ,,,,,,,,,,2020-03-09T18:28:51.000Z
453068319,Import from legacy BWTF database,California,16,South Bay,2/7/2010,11:30:00 AM,2010-02-07T18:30:00Z,students,93,Ballona Freshwater Marsh Outlet,33.970001,-118.433998,,,,,,,,,=,1576,,,,, ,,,,,,,,,,2020-03-09T18:28:50.000Z
453068287,Import from legacy BWTF database,California,16,South Bay,1/24/2010,11:30:00 AM,2010-01-24T18:30:00Z,students,93,Ballona Freshwater Marsh Outlet,33.970001,-118.433998,,,,,,,,,=,145,,,,, ,,,,,,,,,,2020-03-09T18:28:50.000Z
453068186,Import from legacy BWTF database,California,16,South Bay,1/10/2010,11:30:00 AM,2010-01-10T18:30:00Z,students,93,Ballona Freshwater Marsh Outlet,33.970001,-118.433998,,,,,,,,,<,10,,,,, ,,,,,,,,,,2020-03-09T18:28:48.000Z
453068121,Import from legacy BWTF database,California,16,South Bay,12/6/2009,12:30:00 PM,2009-12-06T19:30:00Z,students,93,Ballona Freshwater Marsh Outlet,33.970001,-118.433998,,,,,,,,,=,115,,,,, ,,,,,,,,,,2020-03-09T18:28:48.000Z
453068052,Import from legacy BWTF database,California,16,South Bay,11/15/2009,11:30:00 AM,2009-11-15T18:30:00Z,HS students ,93,Ballona Freshwater Marsh Outlet,33.970001,-118.433998,,,,,,,,,=,275,,,,, ,,,,,,,,,,2020-03-09T18:28:37.000Z
453068037,Import from legacy BWTF database,California,16,South Bay,11/1/2009,11:30:00 AM,2009-11-01T18:30:00Z,HS students,93,Ballona Freshwater Marsh Outlet,33.970001,-118.433998,,,,,,,,,=,633,,,,, ,,,,,,,,,,2020-03-09T18:28:37.000Z
453068029,Import from legacy BWTF database,California,16,South Bay,10/18/2009,10:30:00 AM,2009-10-18T17:30:00Z,Students,93,Ballona Freshwater Marsh Outlet,33.970001,-118.433998,,,,,,,,,=,233,,,,, ,,,,,,,,,,2020-03-09T18:28:37.000Z
453067967,Import from legacy BWTF database,California,16,South Bay,10/4/2009,10:30:00 AM,2009-10-04T17:30:00Z,students,93,Ballona Freshwater Marsh Outlet,33.970001,-118.433998,,,,FALSE,,,,,=,71,,,,, ,,,,,,,,,,2020-03-09T18:28:36.000Z
453066852,Import from legacy BWTF database,California,16,South Bay,3/8/2009,12:30:00 PM,2009-03-08T19:30:00Z,HS students,93,Ballona Freshwater Marsh Outlet,33.970001,-118.433998,,,Partly_Cloudy,,,,,,=,10,,,,, ,,,,,,,,,,2020-03-09T18:26:52.000Z
453066859,Import from legacy BWTF database,California,16,South Bay,2/22/2009,12:30:00 PM,2009-02-22T19:30:00Z,HS students,93,Ballona Freshwater Marsh Outlet,33.970001,-118.433998,,,Partly_Cloudy,,,,,,=,187,,,,, ,,,,,,,,,,2020-03-09T18:26:52.000Z
453066714,Import from legacy BWTF database,California,16,South Bay,2/8/2009,1:30:00 PM,2009-02-08T20:30:00Z,HS students,93,Ballona Freshwater Marsh Outlet,33.970001,-118.433998,,,,,,,,,=,41,,,,, ,,,,,,,,,,2020-03-09T18:26:41.000Z
453066624,Import from legacy BWTF database,California,16,South Bay,1/25/2009,11:30:00 AM,2009-01-25T18:30:00Z,Students after Rain,93,Ballona Freshwater Marsh Outlet,33.970001,-118.433998,,,,,,,,,=,845,,,,, ,,,,,,,,,,2020-03-09T18:26:34.000Z
453066607,Import from legacy BWTF database,California,16,South Bay,1/11/2009,11:30:00 AM,2009-01-11T18:30:00Z,students,93,Ballona Freshwater Marsh Outlet,33.970001,-118.433998,,,,,,,,,=,10,,,,, ,,,,,,,,,,2020-03-09T18:26:34.000Z
453066227,Import from legacy BWTF database,California,16,South Bay,12/7/2008,12:30:00 PM,2008-12-07T19:30:00Z,students,93,Ballona Freshwater Marsh Outlet,33.970001,-118.433998,,,,,,,,,=,152,,,,, ,,,,,,,,,,2020-03-09T18:26:25.000Z
453066044,Import from legacy BWTF database,California,16,South Bay,11/26/2008,10:30:00 AM,2008-11-26T17:30:00Z,Joe & Alan after Rain ,93,Ballona Freshwater Marsh Outlet,33.970001,-118.433998,,,,,,,,,=,1350,,,,, ,,,,,,,,,,2020-03-09T18:26:19.000Z
453066008,Import from legacy BWTF database,California,16,South Bay,11/23/2008,11:30:00 AM,2008-11-23T18:30:00Z,students,93,Ballona Freshwater Marsh Outlet,33.970001,-118.433998,,,,,,,,,=,213,,,,, ,,,,,,,,,,2020-03-09T18:26:19.000Z
453065828,Import from legacy BWTF database,California,16,South Bay,11/9/2008,11:30:00 AM,2008-11-09T18:30:00Z,students,93,Ballona Freshwater Marsh Outlet,33.970001,-118.433998,,,,,,,,,=,72,,,,, ,,,,,,,,,,2020-03-09T18:26:10.000Z
453065803,Import from legacy BWTF database,California,16,South Bay,10/26/2008,10:30:00 AM,2008-10-26T17:30:00Z,students,93,Ballona Freshwater Marsh Outlet,33.970001,-118.433998,,,,,,,,,=,41,,,,, ,,,,,,,,,,2020-03-09T18:26:10.000Z
453066024,Import from legacy BWTF database,California,16,South Bay,10/23/2008,10:30:00 AM,2008-10-23T17:30:00Z, students,93,Ballona Freshwater Marsh Outlet,33.970001,-118.433998,,,,,,,,,=,213,,,,, ,,,,,,,,,,2020-03-09T18:26:19.000Z
453065618,Import from legacy BWTF database,California,16,South Bay,10/12/2008,12:30:00 PM,2008-10-12T19:30:00Z,students,93,Ballona Freshwater Marsh Outlet,33.970001,-118.433998,,,,,,,,,=,41,,,,, ,,,,,,,,,,2020-03-09T18:26:10.000Z
453066357,Import from legacy BWTF database,California,16,South Bay,4/6/2008,10:30:00 AM,2008-04-06T17:30:00Z,students,93,Ballona Freshwater Marsh Outlet,33.970001,-118.433998,,,,,,,,,=,30,,,,, ,,,,,,,,,,2020-03-09T18:26:32.000Z
453066369,Import from legacy BWTF database,California,16,South Bay,3/15/2008,10:30:00 AM,2008-03-15T17:30:00Z,students,93,Ballona Freshwater Marsh Outlet,33.970001,-118.433998,,,,,,,,,=,24196,,,,, ,,,,,,,,,,2020-03-09T18:26:32.000Z
453066374,Import from legacy BWTF database,California,16,South Bay,2/24/2008,11:30:00 AM,2008-02-24T18:30:00Z,students,93,Ballona Freshwater Marsh Outlet,33.970001,-118.433998,,,,,,,,,=,528,,,,, ,,,,,,,,,,2020-03-09T18:26:32.000Z
453066382,Import from legacy BWTF database,California,16,South Bay,1/27/2008,11:30:00 AM,2008-01-27T18:30:00Z,students,93,Ballona Freshwater Marsh Outlet,33.970001,-118.433998,,,,,,,,,=,52,,,,, ,,,,,,,,,,2020-03-09T18:26:33.000Z
453066388,Import from legacy BWTF database,California,16,South Bay,1/20/2008,11:30:00 AM,2008-01-20T18:30:00Z,students,93,Ballona Freshwater Marsh Outlet,33.970001,-118.433998,,,,,,,,,=,63,,,,, ,,,,,,,,,,2020-03-09T18:26:33.000Z
453066394,Import from legacy BWTF database,California,16,South Bay,12/16/2007,11:30:00 AM,2007-12-16T18:30:00Z,students,93,Ballona Freshwater Marsh Outlet,33.970001,-118.433998,,,,,,,,,=,20,,,,, ,,,,,,,,,,2020-03-09T18:26:33.000Z
453066308,Import from legacy BWTF database,California,16,South Bay,12/2/2007,12:30:00 PM,2007-12-02T19:30:00Z,students Rain,93,Ballona Freshwater Marsh Outlet,33.970001,-118.433998,,,,TRUE,,,,,=,160,,,,, ,,,,,,,,,,2020-03-09T18:26:32.000Z
453066290,Import from legacy BWTF database,California,16,South Bay,11/18/2007,12:30:00 PM,2007-11-18T19:30:00Z,students,93,Ballona Freshwater Marsh Outlet,33.970001,-118.433998,,,,,,,,,=,233,,,,, ,,,,,,,,,,2020-03-09T18:26:32.000Z
453066285,Import from legacy BWTF database,California,16,South Bay,11/4/2007,12:30:00 PM,2007-11-04T19:30:00Z,students,93,Ballona Freshwater Marsh Outlet,33.970001,-118.433998,,,,,,,,,=,230,,,,, ,,,,,,,,,,2020-03-09T18:26:32.000Z
453066266,Import from legacy BWTF database,California,16,South Bay,10/21/2007,12:30:00 PM,2007-10-21T19:30:00Z,students,93,Ballona Freshwater Marsh Outlet,33.970001,-118.433998,,,,,,,,,=,959,,,,, ,,,,,,,,,,2020-03-09T18:26:32.000Z
453066260,Import from legacy BWTF database,California,16,South Bay,10/7/2007,12:30:00 PM,2007-10-07T19:30:00Z,students,93,Ballona Freshwater Marsh Outlet,33.970001,-118.433998,,,,,,,,,=,86,,,,, ,,,,,,,,,,2020-03-09T18:26:25.000Z
453066108,Import from legacy BWTF database,California,16,South Bay,3/11/2007,10:30:00 AM,2007-03-11T17:30:00Z,students ,93,Ballona Freshwater Marsh Outlet,33.970001,-118.433998,,,,TRUE,,,,,=,51,,,,, ,,,,,,,,,,2020-03-09T18:26:19.000Z
453066105,Import from legacy BWTF database,California,16,South Bay,2/25/2007,11:30:00 AM,2007-02-25T18:30:00Z,students ,93,Ballona Freshwater Marsh Outlet,33.970001,-118.433998,,,,TRUE,,,,,=,52,,,,, ,,,,,,,,,,2020-03-09T18:26:19.000Z
453066107,Import from legacy BWTF database,California,16,South Bay,2/4/2007,11:30:00 AM,2007-02-04T18:30:00Z,students ,93,Ballona Freshwater Marsh Outlet,33.970001,-118.433998,,,,TRUE,,,,,=,134,,,,, ,,,,,,,,,,2020-03-09T18:26:19.000Z
453066106,Import from legacy BWTF database,California,16,South Bay,1/21/2007,11:30:00 AM,2007-01-21T18:30:00Z,students ,93,Ballona Freshwater Marsh Outlet,33.970001,-118.433998,,,,TRUE,,,,,=,108,,,,, ,,,,,,,,,,2020-03-09T18:26:19.000Z
453066103,Import from legacy BWTF database,California,16,South Bay,1/7/2007,11:30:00 AM,2007-01-07T18:30:00Z,students ,93,Ballona Freshwater Marsh Outlet,33.970001,-118.433998,,,,TRUE,,,,,=,63,,,,, ,,,,,,,,,,2020-03-09T18:26:19.000Z
453066104,Import from legacy BWTF database,California,16,South Bay,1/7/2007,11:30:00 AM,2007-01-07T18:30:00Z,students ,93,Ballona Freshwater Marsh Outlet,33.970001,-118.433998,,,,TRUE,,,,,=,63,,,,, ,,,,,,,,,,2020-03-09T18:26:19.000Z
453066102,Import from legacy BWTF database,California,16,South Bay,12/17/2006,11:30:00 AM,2006-12-17T18:30:00Z,students after Rain,93,Ballona Freshwater Marsh Outlet,33.970001,-118.433998,,,,TRUE,,,,,=,1354,,,,, ,,,,,,,,,,2020-03-09T18:26:19.000Z
453066101,Import from legacy BWTF database,California,16,South Bay,12/3/2006,11:30:00 AM,2006-12-03T18:30:00Z,students,93,Ballona Freshwater Marsh Outlet,33.970001,-118.433998,,,,FALSE,,,,,=,697,,,,, ,,,,,,,,,,2020-03-09T18:26:19.000Z
453066100,Import from legacy BWTF database,California,16,South Bay,11/28/2006,11:30:00 AM,2006-11-28T18:30:00Z,students,93,Ballona Freshwater Marsh Outlet,33.970001,-118.433998,,,,FALSE,,,,,<,10,,,,, ,,,,,,,,,,2020-03-09T18:26:19.000Z
453066099,Import from legacy BWTF database,California,16,South Bay,11/19/2006,11:30:00 AM,2006-11-19T18:30:00Z,Joe & Alan after Rain,93,Ballona Freshwater Marsh Outlet,33.970001,-118.433998,,,,FALSE,,,,,=,1445,,,,, ,,,,,,,,,,2020-03-09T18:26:19.000Z
453066098,Import from legacy BWTF database,California,16,South Bay,10/15/2006,10:30:00 AM,2006-10-15T17:30:00Z,students ,93,Ballona Freshwater Marsh Outlet,33.970001,-118.433998,,,,FALSE,,,,,=,20,,,,, ,,,,,,,,,,2020-03-09T18:26:19.000Z
453066097,Import from legacy BWTF database,California,16,South Bay,10/1/2006,10:30:00 AM,2006-10-01T17:30:00Z,students ,93,Ballona Freshwater Marsh Outlet,33.970001,-118.433998,,,,FALSE,,,,,=,10,,,,, ,,,,,,,,,,2020-03-09T18:26:19.000Z
453060583,Import from legacy BWTF database,California,16,South Bay,4/10/2006,12:30:00 PM,2006-04-10T19:30:00Z,students,93,Ballona Freshwater Marsh Outlet,33.970001,-118.433998,,,,,,,,,<,10,=,31,=,1300, ,,,,,,,,,,2020-03-09T18:22:39.000Z
453060304,Import from legacy BWTF database,California,16,South Bay,3/26/2006,12:30:00 PM,2006-03-26T19:30:00Z,students,93,Ballona Freshwater Marsh Outlet,33.970001,-118.433998,,,,,,,,,=,30,=,96,=,6867, ,,,,,,,,,,2020-03-09T18:22:38.000Z
453060214,Import from legacy BWTF database,California,16,South Bay,3/12/2006,11:30:00 AM,2006-03-12T18:30:00Z,students,93,Ballona Freshwater Marsh Outlet,33.970001,-118.433998,,,,,,,,,<,10,=,200,=,2280, ,,,,,,,,,,2020-03-09T18:22:38.000Z
453060205,Import from legacy BWTF database,California,16,South Bay,2/28/2006,11:30:00 AM,2006-02-28T18:30:00Z,students,93,Ballona Freshwater Marsh Outlet,33.970001,-118.433998,,,,,,,,,=,250,=,1211,=,24196, ,,,,,,,,,,2020-03-09T18:22:38.000Z
453060194,Import from legacy BWTF database,California,16,South Bay,2/26/2006,11:30:00 AM,2006-02-26T18:30:00Z,students,93,Ballona Freshwater Marsh Outlet,33.970001,-118.433998,,,,,,,,,=,10,=,199,=,15531, ,,,,,,,,,,2020-03-09T18:22:30.000Z
453060046,Import from legacy BWTF database,California,16,South Bay,1/23/2006,12:30:00 PM,2006-01-23T19:30:00Z,student,93,Ballona Freshwater Marsh Outlet,33.970001,-118.433998,,,,,,,,,=,52,=,84,=,1172, ,,,,,,,,,,2020-03-09T18:22:30.000Z
453060035,Import from legacy BWTF database,California,16,South Bay,1/9/2006,12:30:00 PM,2006-01-09T19:30:00Z,student,93,Ballona Freshwater Marsh Outlet,33.970001,-118.433998,,,,,,,,,=,97,=,404,=,3873, ,,,,,,,,,,2020-03-09T18:22:30.000Z
453060023,Import from legacy BWTF database,California,16,South Bay,12/19/2005,12:30:00 PM,2005-12-19T19:30:00Z,student,93,Ballona Freshwater Marsh Outlet,33.970001,-118.433998,,,,,,,,,=,41,=,479,=,2247, ,,,,,,,,,,2020-03-09T18:22:30.000Z
453060011,Import from legacy BWTF database,California,16,South Bay,12/4/2005,12:30:00 PM,2005-12-04T19:30:00Z,student,93,Ballona Freshwater Marsh Outlet,33.970001,-118.433998,,,,,,,,,=,20,=,177,=,19863, ,,,,,,,,,,2020-03-09T18:22:30.000Z
453059998,Import from legacy BWTF database,California,16,South Bay,11/20/2005,12:30:00 PM,2005-11-20T19:30:00Z,student,93,Ballona Freshwater Marsh Outlet,33.970001,-118.433998,,,,,,,,,=,118,=,146,=,24196, ,,,,,,,,,,2020-03-09T18:22:29.000Z
453059987,Import from legacy BWTF database,California,16,South Bay,11/6/2005,12:30:00 PM,2005-11-06T19:30:00Z,student,93,Ballona Freshwater Marsh Outlet,33.970001,-118.433998,,,,,,,,,=,522,=,908,=,10462, ,,,,,,,,,,2020-03-09T18:22:29.000Z
453059977,Import from legacy BWTF database,California,16,South Bay,10/24/2005,12:30:00 PM,2005-10-24T19:30:00Z,student,93,Ballona Freshwater Marsh Outlet,33.970001,-118.433998,,,,,,,,,=,305,=,1022,=,24196, ,,,,,,,,,,2020-03-09T18:22:29.000Z
453059964,Import from legacy BWTF database,California,16,South Bay,10/9/2005,12:30:00 PM,2005-10-09T19:30:00Z,student,93,Ballona Freshwater Marsh Outlet,33.970001,-118.433998,,,,,,,,,=,10,=,185,=,4890, ,,,,,,,,,,2020-03-09T18:22:29.000Z